-- phpMyAdmin SQL Dump
-- version 4.8.3
-- https://www.phpmyadmin.net/
--
-- Host: localhost
-- Generation Time: Sep 10, 2024 at 03:54 PM
-- Server version: 5.7.42-0ubuntu0.18.04.1
-- PHP Version: 7.2.34-21+ubuntu18.04.1+deb.sury.org+1

SET SQL_MODE = "NO_AUTO_VALUE_ON_ZERO";
SET AUTOCOMMIT = 0;
START TRANSACTION;
SET time_zone = "+00:00";


/*!40101 SET @OLD_CHARACTER_SET_CLIENT=@@CHARACTER_SET_CLIENT */;
/*!40101 SET @OLD_CHARACTER_SET_RESULTS=@@CHARACTER_SET_RESULTS */;
/*!40101 SET @OLD_COLLATION_CONNECTION=@@COLLATION_CONNECTION */;
/*!40101 SET NAMES utf8mb4 */;

--
-- Database: `hartpunt`
--

-- --------------------------------------------------------

--
-- Table structure for table `agenda_durations`
--

CREATE TABLE `agenda_durations` (
  `id` int(11) NOT NULL,
  `duration_doctor` int(11) NOT NULL,
  `duration_treatment` int(11) NOT NULL,
  `duration_time` int(11) NOT NULL,
  `created_at` varchar(50) NOT NULL,
  `updated_at` varchar(50) NOT NULL
) ENGINE=InnoDB DEFAULT CHARSET=latin1;

--
-- Dumping data for table `agenda_durations`
--

INSERT INTO `agenda_durations` (`id`, `duration_doctor`, `duration_treatment`, `duration_time`, `created_at`, `updated_at`) VALUES
(4, 29, 20, 22, '2023-11-09 07:56:35', '2024-06-24 10:26:04'),
(5, 29, 20, 20, '2024-01-20 20:14:39', '2024-05-24 06:10:33'),
(6, 29, 20, 30, '2024-01-21 18:57:18', '2024-05-24 06:10:37'),
(8, 29, 21, 15, '2024-04-02 09:18:47', '2024-04-02 09:18:47');

-- --------------------------------------------------------

--
-- Table structure for table `agenda_services`
--

CREATE TABLE `agenda_services` (
  `id` int(11) NOT NULL,
  `service_name` varchar(200) DEFAULT NULL,
  `treatment_description` text NOT NULL,
  `duration` varchar(20) NOT NULL,
  `status` tinyint(1) DEFAULT '1',
  `created_at` varchar(100) DEFAULT NULL,
  `updated_at` varchar(100) DEFAULT NULL,
  `show_in_script` varchar(20) NOT NULL DEFAULT ''
) ENGINE=InnoDB DEFAULT CHARSET=latin1;

--
-- Dumping data for table `agenda_services`
--

INSERT INTO `agenda_services` (`id`, `service_name`, `treatment_description`, `duration`, `status`, `created_at`, `updated_at`, `show_in_script`) VALUES
(20, 'TTE', 'TTE', '54', 1, '2024-01-20 20:14:12', '2024-08-20 06:46:24', 'no'),
(21, 'NIEUW PATIENT', 'NIEUW PATIENT', '15', 1, '2024-01-20 20:14:28', '2024-01-20 20:14:28', 'no'),
(22, 'CONTROLE PATIENT', 'CONTROLE PATIENT', '15', 1, '2024-01-21 18:56:49', '2024-01-21 18:56:49', 'no'),
(23, 'BELAFSPRAAK', 'BELAFSPRAAK', '5', 1, '2024-02-01 20:27:16', '2024-02-01 20:27:16', 'no'),
(24, 'TTE + FIETSTEST', 'TTE + FIETSTEST', '20', 1, '2024-02-01 20:27:32', '2024-02-01 20:27:32', 'no'),
(25, 'FIETSTEST', 'FIETSTEST', '20', 1, '2024-02-01 20:41:19', '2024-02-01 20:41:19', 'no');

-- --------------------------------------------------------

--
-- Table structure for table `appoitments`
--

CREATE TABLE `appoitments` (
  `id` int(11) NOT NULL,
  `user_id` int(11) NOT NULL,
  `appoitment_type` varchar(50) NOT NULL,
  `location` varchar(50) NOT NULL,
  `treatment_type` varchar(50) NOT NULL,
  `seperate_appoitment_text` varchar(255) NOT NULL,
  `start_date` varchar(50) NOT NULL,
  `start_time` varchar(50) NOT NULL,
  `end_date` varchar(50) NOT NULL,
  `end_time` varchar(50) NOT NULL,
  `doctor` varchar(50) NOT NULL,
  `description` text NOT NULL,
  `customer_id` varchar(50) NOT NULL,
  `customer_type` varchar(20) NOT NULL,
  `status` varchar(20) NOT NULL,
  `notes` text NOT NULL,
  `cancel_appoitment_status` varchar(50) NOT NULL,
  `created_at` varchar(50) NOT NULL,
  `updated_at` varchar(50) NOT NULL,
  `reminder_email` int(11) NOT NULL DEFAULT '0',
  `booking_type` varchar(50) NOT NULL DEFAULT 'admin'
) ENGINE=InnoDB DEFAULT CHARSET=latin1;

--
-- Dumping data for table `appoitments`
--

INSERT INTO `appoitments` (`id`, `user_id`, `appoitment_type`, `location`, `treatment_type`, `seperate_appoitment_text`, `start_date`, `start_time`, `end_date`, `end_time`, `doctor`, `description`, `customer_id`, `customer_type`, `status`, `notes`, `cancel_appoitment_status`, `created_at`, `updated_at`, `reminder_email`, `booking_type`) VALUES
(153, 1, 'seperate', '19', '', 'doctor', '2024-06-16', '08:10', '2024-06-16', '08:25', '73', '7ik', '34', 'existing', 'created', '', '', '2024-06-14 05:17:31', '2024-06-17 05:18:01', 0, 'admin'),
(155, 1, 'seperate', '19', '', '4wytw4y', '2024-06-19', '07:50', '2024-06-19', '08:05', '29', 'test', '34', 'existing', 'created', '', '', '2024-06-14 10:05:05', '2024-06-24 05:33:17', 0, 'admin'),
(157, 1, 'standard', '19', '21', '', '2024-06-13', '08:30', '2024-06-13', '08:45', '50', '', '30', 'existing', 'created', '', '', '2024-06-14 20:02:29', '2024-06-24 06:29:02', 0, 'admin'),
(159, 1, 'standard', '19', '22', '', '2024-06-18', '8:00', '2024-06-18', '08:15', '61', 'test', '0', 'without', 'created', '', '', '2024-06-17 05:19:13', '2024-06-17 05:19:13', 0, 'admin'),
(168, 1, 'seperate', '21', '', 'heart', '2024-06-18', '10:40', '2024-06-18', '10:55', '78', 'tester', '23', 'existing', 'created', '', '', '2024-06-17 06:25:09', '2024-06-19 06:54:45', 0, 'admin'),
(170, 1, 'standard', '19', '21', '', '2024-09-19', '08:20', '2024-09-19', '08:35', '29', 'test', '23', 'existing', 'created', '', '', '2024-06-17 06:29:32', '2024-09-03 07:41:25', 0, 'admin'),
(177, 1, 'seperate', '19', '', '4wytw4y', '2024-06-22', '07:50', '2024-06-22', '08:44', '61', 'et', '33', 'existing', 'created', '', '', '2024-06-19 06:10:30', '2024-06-19 09:56:03', 0, 'admin'),
(179, 1, 'seperate', '19', '', '4wytw4y', '2024-06-21', '07:50', '2024-06-21', '08:10', '29', 'test44', '105', 'existing', 'created', '', '', '2024-06-20 07:12:49', '2024-06-21 11:24:47', 0, 'admin'),
(180, 1, 'standard', '22', '23', '', '2024-06-19', '08:10', '2024-06-19', '09:04', '29', '', '106', 'existing', 'created', '', '', '2024-06-21 07:39:09', '2024-06-21 07:39:09', 0, 'admin'),
(186, 1, 'standard', '19', '21', '', '2024-06-13', '08:23', '2024-06-13', '02:45', '91', 'test', '30', 'existing', 'created', '', '', '2024-07-04 07:50:34', '2024-09-02 06:00:04', 0, 'admin'),
(188, 1, 'standard', '19', '21', '', '2024-07-03', '09:10', '2024-07-03', '09:25', '29', '', '42', 'existing', 'created', '', '', '2024-07-04 11:37:53', '2024-07-04 11:37:53', 0, 'admin'),
(189, 1, 'standard', '19', '20', '', '2024-07-03', '08:30', '2024-07-03', '08:50', '29', '', '105', 'existing', 'created', '', '', '2024-07-04 12:21:46', '2024-07-04 12:21:46', 0, 'admin'),
(191, 1, 'standard', '19', '21', '', '2024-07-02', '07:50', '2024-07-02', '08:05', '90', '', '23', 'existing', 'created', '', '', '2024-07-05 06:24:57', '2024-07-05 06:24:57', 0, 'admin'),
(193, 1, 'standard', '19', '24', '', '2024-07-03', '09:00', '2024-07-03', '09:20', '29', '', '23', 'existing', 'created', '', '', '2024-07-07 17:36:57', '2024-07-07 17:36:57', 0, 'admin'),
(199, 1, 'standard', '19', '21', '', '2024-07-10', '09:00', '2024-07-10', '09:15', '95', 'test', '30', 'existing', 'created', '', '', '2024-07-10 18:10:42', '2024-09-02 05:57:30', 0, 'admin'),
(201, 1, 'standard', '19', '23', '', '2024-09-18', '07:50', '2024-09-18', '08:05', '91', 'test', '118', 'existing', 'created', '', '', '2024-07-11 05:09:26', '2024-09-03 05:59:20', 0, 'admin'),
(205, 1, 'standard', '19', '22', '', '2024-07-09', '08:10', '2024-07-09', '08:25', '93', 'test', '0', 'existing', 'created', '', '', '2024-07-11 05:43:24', '2024-08-27 07:07:09', 0, 'admin'),
(219, 1, 'standard', '19', '20', '', '2024-08-15', '08:00', '2024-08-15', '08:15', '93', 'test', '0', 'without', 'created', '', '', '2024-08-16 20:42:44', '2024-08-22 07:13:53', 0, 'admin'),
(220, 1, 'standard', '19', '23', '', '2024-09-12', '07:30', '2024-09-12', '07:50', '93', 'test11', '27', 'existing', 'created', '', '', '2024-08-19 07:02:49', '2024-09-03 06:38:45', 0, 'admin'),
(221, 1, 'seperate', '19', '', 'test', '2024-09-18', '07:30', '2024-09-18', '07:45', '29', 'test11', '34', 'existing', 'created', '', '', '2024-08-20 06:47:24', '2024-09-03 06:38:27', 0, 'admin'),
(222, 1, 'seperate', '19', '', 'test', '2024-09-11', '07:40', '2024-09-11', '08:23', '29', 'test11', '30', 'existing', 'created', '', '', '2024-08-22 06:16:47', '2024-09-03 06:32:12', 0, 'admin'),
(223, 1, 'standard', '19', '23', '', '2024-09-11', '08:00', '2024-09-11', '08:05', '93', 'wet4g', '119', 'existing', 'created', '', '', '2024-08-23 05:34:00', '2024-09-03 05:55:23', 0, 'admin'),
(224, 1, 'standard', '19', '21', '', '2024-09-11', '07:50', '2024-09-11', '08:05', '94', 'yr', '119', 'existing', 'created', '', '', '2024-08-23 05:47:16', '2024-09-03 05:53:40', 0, 'admin'),
(225, 1, 'standard', '19', '21', '', '2024-09-11', '07:40', '2024-09-11', '07:55', '91', 'war', '119', 'existing', 'created', '', '', '2024-08-23 05:49:39', '2024-09-03 06:02:56', 0, 'admin'),
(226, 1, 'standard', '19', '22', '', '2024-09-11', '08:20', '2024-09-11', '08:35', '94', 'aeg', '0', 'without', 'created', '', '', '2024-08-23 05:53:27', '2024-09-03 05:55:06', 0, 'admin'),
(227, 1, 'standard', '19', '22', '', '2024-08-25', '08:10', '2024-08-25', '08:25', '93', 'ey', '119', 'existing', 'created', '', '', '2024-08-23 05:54:46', '2024-08-23 05:54:46', 0, 'admin'),
(228, 1, 'standard', '19', '21', '', '2024-08-21', '09:10', '2024-08-21', '09:25', '93', 'dh', '119', 'existing', 'created', '', '', '2024-08-23 05:56:53', '2024-08-23 05:56:53', 0, 'admin'),
(229, 1, 'standard', '19', '22', '', '2024-08-20', '08:50', '2024-08-20', '09:05', '93', 'et', '119', 'existing', 'created', '', '', '2024-08-23 05:59:01', '2024-08-23 05:59:01', 0, 'admin'),
(230, 1, 'standard', '19', '22', '', '2024-08-25', '07:40', '2024-08-25', '07:55', '93', 'iu56', '119', 'existing', 'created', '', '', '2024-08-23 06:01:44', '2024-08-23 06:01:44', 0, 'admin'),
(231, 1, 'standard', '19', '21', '', '2024-08-23', '09:00', '2024-08-23', '09:15', '95', 'w4t', '119', 'existing', 'created', '', '', '2024-08-23 06:03:06', '2024-08-23 06:03:06', 0, 'admin'),
(232, 1, 'standard', '19', '21', '', '2024-08-22', '09:00', '2024-08-22', '09:15', '93', 'dsg test', '119', 'existing', 'created', '', '', '2024-08-23 06:05:30', '2024-09-03 07:20:50', 0, 'admin'),
(233, 1, 'standard', '19', '21', '', '2024-08-24', '08:40', '2024-08-24', '08:55', '91', 'dagggggggg', '119', 'existing', 'created', '', '', '2024-08-23 06:14:59', '2024-08-23 06:14:59', 0, 'admin'),
(235, 1, 'standard', '19', '21', '', '2024-09-11', '08:30', '2024-09-11', '09:00', '96', 'First visit: The patient is complaining about the palpitations', '27', 'existing', 'created', '', '', '2024-08-23 11:44:23', '2024-09-03 07:05:21', 0, 'admin'),
(236, 1, 'standard', '19', '22', '', '2024-09-10', '07:40', '2024-09-10', '07:55', '29', 'test', '30', 'existing', 'created', '', '', '2024-08-26 08:59:34', '2024-09-03 05:51:06', 0, 'admin'),
(237, 1, 'standard', '19', '20', '', '2024-05-29', '07:30', '2024-05-29', '07:52', '29', 'test', '23', 'existing', 'created', '', '', '2024-08-28 09:23:07', '2024-08-28 19:09:03', 0, 'admin'),
(238, 1, 'seperate', '19', '', 'testcs', '2024-09-11', '07:40', '2024-09-11', '08:00', '29', 'testcs for appointment', '125', 'existing', 'created', '', '', '2024-08-29 05:08:53', '2024-09-03 05:54:08', 0, 'admin'),
(239, 1, 'standard', '19', '22', '', '2024-09-27', '07:40', '2024-09-27', '07:50', '29', '', '0', 'without', 'created', '', '', '2024-08-29 05:36:46', '2024-09-03 05:56:02', 0, 'admin'),
(240, 1, 'seperate', '19', '', 'testcs', '2024-09-11', '07:30', '2024-09-11', '07:40', '29', 'testcs', '125', 'existing', 'created', '', '', '2024-08-29 05:43:40', '2024-09-03 05:56:17', 0, 'admin'),
(241, 1, 'standard', '19', '20', '', '2024-09-12', '07:50', '2024-09-12', '08:44', '96', '', '27', 'existing', 'created', '', '', '2024-08-29 06:53:15', '2024-09-03 05:57:00', 0, 'admin'),
(242, 1, 'standard', '19', '22', '', '2024-09-12', '09:10', '2024-09-12', '10:04', '93', 'test', '121', 'existing', 'created', '', '', '2024-09-02 05:56:39', '2024-09-03 06:33:09', 0, 'admin'),
(243, 1, 'seperate', '19', '', 'testcs', '2024-09-10', '07:49', '2024-09-10', '08:04', '94', 'test', '126', 'existing', 'created', '', '', '2024-09-02 06:09:50', '2024-09-03 05:49:35', 0, 'admin'),
(245, 1, 'standard', '19', '21', '', '2024-09-11', '07:50', '2024-09-11', '08:44', '91', 'testcs', '30', 'existing', 'created', '', '', '2024-09-02 06:50:29', '2024-09-03 05:50:32', 0, 'admin'),
(246, 1, 'standard', '19', '20', '', '2024-09-13', '07:40', '2024-09-13', '08:02', '29', 'test', '0', 'without', 'created', '', '', '2024-09-03 05:58:23', '2024-09-03 06:32:31', 0, 'admin'),
(247, 1, 'standard', '20', '21', '', '2024-09-04', '07:50', '2024-09-04', '08:05', '94', 'test 1', '23', 'existing', 'created', '', '', '2024-09-04 06:18:03', '2024-09-06 06:05:44', 0, 'admin'),
(248, 1, 'seperate', '19', '', 'hartpunt test', '2024-09-19', '07:40', '2024-09-19', '08:34', '93', 'test summary', '112', 'existing', 'created', '', '', '2024-09-04 06:31:49', '2024-09-04 06:31:49', 0, 'admin'),
(249, 1, 'seperate', '20', '', 'test', '2024-09-17', '08:00', '2024-09-17', '08:15', '99', 'test', '23', 'existing', 'created', '', '', '2024-09-04 06:43:03', '2024-09-04 06:43:33', 0, 'admin'),
(250, 1, 'seperate', '19', '', 'test', '2024-09-19', '07:50', '2024-09-19', '08:12', '94', 'tst', '23', 'existing', 'created', '', '', '2024-09-04 06:44:54', '2024-09-04 06:44:54', 0, 'admin'),
(251, 1, 'seperate', '20', '', 'test', '2024-09-05', '07:30', '2024-09-05', '07:40', 'book_without_doctor', 'test', '23', 'existing', 'created', '', '', '2024-09-04 07:11:44', '2024-09-04 07:11:44', 0, 'admin'),
(252, 1, 'seperate', '19', '', 'Test', '2024-09-03', '08:10', '2024-09-03', '08:20', '29', '', '23', 'existing', 'created', '', '', '2024-09-05 10:30:04', '2024-09-06 11:38:05', 0, 'admin'),
(253, 1, 'seperate', '19', '', 'oPD', '2024-09-03', '08:20', '2024-09-03', '08:35', '29', '', '34', 'existing', 'created', '', '', '2024-09-05 10:31:36', '2024-09-06 05:17:19', 0, 'admin'),
(254, 1, 'seperate', '19', '', 'testcs', '2024-09-05', '07:50', '2024-09-05', '08:05', '29', 'testcs', '0', 'without', 'created', '', '', '2024-09-05 11:51:19', '2024-09-05 11:51:19', 0, 'admin'),
(255, 1, 'standard', '19', '20', '', '2024-09-06', '07:50', '2024-09-06', '08:12', '29', '', '0', 'without', 'created', '', '', '2024-09-06 05:15:38', '2024-09-06 05:15:38', 0, 'admin'),
(256, 1, 'standard', '19', '22', '', '2024-09-07', '07:40', '2024-09-07', '07:55', '94', '', '10', 'existing', 'created', '', '', '2024-09-06 06:08:35', '2024-09-06 06:08:35', 0, 'admin'),
(257, 1, 'standard', '19', '22', '', '2024-09-02', '08:00', '2024-09-02', '08:15', '100', 'test', '30', 'existing', 'created', '', '', '2024-09-06 06:23:58', '2024-09-06 06:24:42', 0, 'admin'),
(258, 1, 'seperate', '19', '', 'testcs', '2024-09-06', '08:00', '2024-09-06', '08:54', '49', '', '125', 'new', 'created', '', '', '2024-09-06 06:56:57', '2024-09-06 06:56:57', 0, 'admin'),
(259, 1, 'seperate', '19', '', 'testcs testing', '2024-09-02', '08:40', '2024-09-02', '08:55', '49', 'testcs testing', '128', 'new', 'created', '', '', '2024-09-06 06:59:14', '2024-09-06 06:59:14', 0, 'admin'),
(260, 1, 'seperate', '19', '', 'testcs testing', '2024-09-07', '08:50', '2024-09-07', '09:00', '49', 'testcs testing', '128', 'existing', 'created', '', '', '2024-09-06 07:00:29', '2024-09-06 07:00:29', 0, 'admin'),
(261, 1, 'standard', '19', '20', '', '2024-09-02', '08:50', '2024-09-02', '09:12', '29', 'testcs doctor', '129', 'new', 'created', '', '', '2024-09-06 07:02:14', '2024-09-06 07:02:14', 0, 'admin'),
(262, 1, 'seperate', '19', '', 'testcs test', '2024-09-07', '09:10', '2024-09-07', '09:20', '29', 'testcs test', '23', 'existing', 'created', '', '', '2024-09-06 07:03:38', '2024-09-06 07:03:38', 0, 'admin'),
(263, 1, 'standard', '20', '23', '', '2024-09-16', '07:40', '2024-09-16', '07:45', '29', 'testcs', '130', 'new', 'created', '', '', '2024-09-06 07:41:24', '2024-09-06 07:41:24', 0, 'admin'),
(264, 1, 'seperate', '19', '', 'testcs tests', '2024-09-17', '07:40', '2024-09-17', '08:34', '49', 'testcs', '130', 'new', 'created', '', '', '2024-09-06 07:43:24', '2024-09-06 07:43:24', 0, 'admin'),
(265, 1, 'standard', '19', '21', '', '2024-09-08', '07:30', '2024-09-08', '07:45', '91', '', '0', 'without', 'created', '', '', '2024-09-06 11:38:22', '2024-09-06 11:38:22', 0, 'admin'),
(266, 1, 'standard', '19', '20', '', '2024-09-13', '09:00', '2024-09-13', '09:30', '29', '', '1', 'existing', 'created', '', '', '2024-09-09 14:11:53', '2024-09-09 14:12:10', 0, 'admin'),
(267, 1, 'standard', '19', '20', '', '2024-09-14', '07:50', '2024-09-14', '12:00', '29', '', '0', 'without', 'created', '', '', '2024-09-10 05:15:11', '2024-09-10 05:15:11', 0, 'admin');

-- --------------------------------------------------------

--
-- Table structure for table `appoitment_status`
--

CREATE TABLE `appoitment_status` (
  `id` int(11) NOT NULL,
  `appoitment_id` int(11) NOT NULL,
  `status` varchar(50) NOT NULL,
  `created_at` varchar(20) NOT NULL,
  `updated_at` varchar(20) NOT NULL
) ENGINE=InnoDB DEFAULT CHARSET=latin1;

--
-- Dumping data for table `appoitment_status`
--

INSERT INTO `appoitment_status` (`id`, `appoitment_id`, `status`, `created_at`, `updated_at`) VALUES
(1, 1, 'Left', '2023-10-11 07:25:41', '2023-10-13 06:40:41'),
(4, 68, 'Arrived', '2023-10-12 13:36:50', '2023-10-12 13:36:50'),
(5, 67, 'Arrived', '2023-10-12 13:41:01', '2023-10-12 13:41:01'),
(6, 62, 'Arrived', '2023-10-13 06:39:14', '2023-10-13 06:39:14'),
(9, 94, 'Departed', '2024-01-21 18:58:37', '2024-01-21 18:59:02'),
(10, 117, 'Arrived', '2024-05-09 11:59:32', '2024-05-09 11:59:32'),
(11, 119, 'Arrived', '2024-05-31 08:54:51', '2024-05-31 08:54:51'),
(12, 125, 'Waiting room', '2024-06-03 07:37:04', '2024-06-05 06:26:18'),
(20, 143, 'Waiting room', '2024-06-12 09:20:02', '2024-06-12 09:20:02'),
(25, 155, 'Departed', '2024-06-14 10:35:11', '2024-06-26 05:42:39'),
(29, 170, 'Appointment is ready', '2024-06-17 06:43:09', '2024-09-03 07:25:41'),
(33, 157, 'Is gebeld', '2024-06-24 06:49:04', '2024-09-09 05:20:21'),
(35, 179, 'Departed', '2024-06-24 07:59:48', '2024-08-08 09:02:43'),
(36, 177, 'Arrived', '2024-06-28 11:59:46', '2024-06-28 11:59:46'),
(38, 188, 'Departed', '2024-07-04 12:17:14', '2024-07-04 12:17:37'),
(39, 191, 'Not yet present', '2024-07-05 07:02:11', '2024-08-26 08:55:43'),
(41, 201, 'Absent with message', '2024-07-11 05:12:49', '2024-09-04 06:56:04'),
(42, 205, 'Not yet present', '2024-07-11 05:44:30', '2024-09-02 07:33:28'),
(47, 219, 'Departed', '2024-08-16 20:43:10', '2024-09-03 09:12:44'),
(48, 220, 'Departed', '2024-08-20 04:34:21', '2024-09-02 12:53:19'),
(49, 221, 'Absent with message', '2024-08-20 06:48:55', '2024-09-02 12:53:12'),
(50, 186, 'Voicemail ingesproken', '2024-08-21 06:32:58', '2024-09-03 07:37:47'),
(51, 236, 'Absent without notice', '2024-08-27 05:40:52', '2024-09-02 12:26:28'),
(52, 224, 'Arrived', '2024-08-27 07:02:49', '2024-08-29 13:01:54'),
(53, 199, 'Appointment is ongoing', '2024-08-27 07:07:53', '2024-09-02 07:00:09'),
(54, 237, 'Appointment is ready', '2024-08-28 09:23:45', '2024-08-28 09:23:45'),
(55, 225, 'Absent without notice', '2024-08-29 06:28:36', '2024-09-02 12:54:31'),
(56, 153, 'Absent with message', '2024-09-02 04:22:28', '2024-09-02 05:15:12'),
(57, 240, 'Absent with message', '2024-09-02 06:21:46', '2024-09-09 04:05:17'),
(59, 243, 'Appointment is ready', '2024-09-02 06:31:09', '2024-09-03 05:49:22'),
(60, 245, 'Absent without notice', '2024-09-02 06:50:45', '2024-09-02 12:26:13'),
(61, 226, 'Not yet present', '2024-09-02 12:54:17', '2024-09-02 12:54:17'),
(62, 235, 'Not yet present', '2024-09-02 12:54:23', '2024-09-02 12:54:23'),
(63, 238, 'Waiting room', '2024-09-03 05:53:24', '2024-09-03 05:53:24'),
(64, 222, 'Not yet present', '2024-09-03 06:32:04', '2024-09-03 06:32:04'),
(65, 246, 'Waiting room', '2024-09-03 06:32:19', '2024-09-03 06:32:19'),
(66, 232, 'Sms ontvangen', '2024-09-03 07:13:07', '2024-09-03 07:13:07'),
(67, 247, 'Absent with message', '2024-09-04 06:18:42', '2024-09-06 06:32:01'),
(68, 249, 'Departed', '2024-09-04 06:43:25', '2024-09-04 06:43:25'),
(69, 250, 'Is gebeld', '2024-09-04 06:56:11', '2024-09-04 06:56:11'),
(70, 254, 'Is gebeld', '2024-09-05 11:53:39', '2024-09-05 11:53:39'),
(71, 253, 'Absent with message', '2024-09-05 11:55:40', '2024-09-06 06:27:47'),
(72, 252, 'Absent without notice', '2024-09-05 12:32:49', '2024-09-06 06:12:48'),
(73, 251, 'Absent without notice', '2024-09-05 12:35:46', '2024-09-05 12:35:46'),
(74, 255, 'Appointment is ongoing', '2024-09-06 05:24:54', '2024-09-06 05:24:54'),
(75, 256, 'Arrived', '2024-09-06 06:10:24', '2024-09-06 11:37:12'),
(76, 257, 'Absent without notice', '2024-09-06 06:24:26', '2024-09-06 06:24:26'),
(77, 262, 'Arrived', '2024-09-06 07:08:01', '2024-09-06 07:08:01'),
(78, 260, 'Waiting room', '2024-09-06 07:08:22', '2024-09-06 07:08:22'),
(79, 242, 'Appointment is ongoing', '2024-09-09 05:10:37', '2024-09-09 05:10:37');

-- --------------------------------------------------------

--
-- Table structure for table `availabilty`
--

CREATE TABLE `availabilty` (
  `id` int(11) NOT NULL,
  `location_id` int(11) DEFAULT '0',
  `start_date` varchar(20) NOT NULL,
  `start_time` varchar(20) NOT NULL,
  `end_time` varchar(20) NOT NULL,
  `availabilty_repeat` varchar(50) NOT NULL,
  `appoitment_type` varchar(20) NOT NULL,
  `parent_availability_id` int(11) NOT NULL,
  `created_at` varchar(20) NOT NULL,
  `updated_at` varchar(20) NOT NULL
) ENGINE=InnoDB DEFAULT CHARSET=latin1;

--
-- Dumping data for table `availabilty`
--

INSERT INTO `availabilty` (`id`, `location_id`, `start_date`, `start_time`, `end_time`, `availabilty_repeat`, `appoitment_type`, `parent_availability_id`, `created_at`, `updated_at`) VALUES
(1, 3, '2023-11-08', '09:00', '10:00', 'no_repeat', 'select', 0, '2023-11-08 14:55:54', '2023-11-08 14:55:54'),
(2, 3, '2023-11-14', '09:00', '10:00', 'no_repeat', 'select', 0, '2023-11-14 13:19:30', '2023-11-14 13:19:30'),
(3, 3, '2023-12-21', '08:10', '09:10', 'no_repeat', 'all', 0, '2023-12-22 06:49:54', '2023-12-22 06:49:54'),
(4, 3, '2023-12-20', '08:20', '09:20', 'no_repeat', 'select', 0, '2023-12-22 06:51:03', '2024-03-27 11:07:03'),
(6, 3, '2024-01-25', '08:00', '09:00', 'no_repeat', 'select', 0, '2024-01-02 09:12:25', '2024-05-06 06:52:39'),
(7, 3, '2024-01-21', '09:00', '18:00', 'no_repeat', 'all', 0, '2024-01-20 20:15:45', '2024-01-20 20:15:45'),
(8, 18, '2024-01-22', '09:00', '17:00', 'no_repeat', 'all', 0, '2024-01-21 18:55:26', '2024-01-21 18:55:26'),
(9, 3, '2024-02-19', '10:00', '11:00', 'no_repeat', 'select', 0, '2024-02-01 09:01:03', '2024-02-01 09:01:03'),
(10, 3, '2024-03-12', '08:10', '09:10', 'no_repeat', 'select', 0, '2024-03-12 12:55:54', '2024-03-12 12:55:54'),
(11, 3, '2024-04-20', '08:00', '18:00', 'no_repeat', 'all', 0, '2024-04-15 09:09:56', '2024-04-15 09:09:56'),
(12, 18, '2024-05-11', '08:00', '09:00', 'no_repeat', 'select', 0, '2024-05-06 06:51:55', '2024-05-06 06:56:21'),
(13, 3, '2024-05-22', '08:00', '09:00', 'no_repeat', 'select', 0, '2024-05-06 06:53:22', '2024-05-27 06:30:07'),
(14, 3, '2024-06-13', '08:00', '17:00', 'no_repeat', 'all', 0, '2024-06-13 20:56:37', '2024-06-13 20:56:37'),
(16, 19, '2024-06-17', '08:00', '10:00', 'no_repeat', 'select', 0, '2024-06-17 06:22:45', '2024-06-17 06:22:45'),
(18, 19, '2024-06-19', '07:50', '10:30', 'no_repeat', 'select', 0, '2024-06-19 07:24:16', '2024-06-19 07:24:16'),
(19, 19, '2024-07-02', '09:00', '10:00', 'no_repeat', 'select', 0, '2024-07-03 06:58:24', '2024-07-04 12:20:00'),
(21, 19, '2024-08-19', '07:30', '08:30', 'no_repeat', 'select', 0, '2024-08-19 07:37:38', '2024-08-27 05:34:39'),
(22, 19, '2024-08-19', '08:30', '09:30', '', 'select', 0, '2024-08-20 10:15:23', '2024-08-20 10:15:23'),
(23, 19, '2024-08-19', '08:30', '09:30', '', 'select', 0, '2024-08-20 10:15:23', '2024-08-20 10:15:23'),
(24, 19, '2024-08-21', '08:30', '09:30', '', 'all', 0, '2024-08-23 11:43:01', '2024-08-23 11:43:01'),
(25, 19, '2024-08-29', '07:30', '08:30', 'no_repeat', 'select', 0, '2024-08-28 06:11:40', '2024-08-28 09:22:16'),
(26, 19, '2024-09-02', '07:40', '08:40', 'no_repeat', 'select', 0, '2024-08-28 06:13:20', '2024-09-02 05:42:06'),
(27, 19, '2024-09-13', '09:00', '17:00', 'no_repeat', 'all', 0, '2024-09-09 14:10:13', '2024-09-09 14:10:13'),
(28, 19, '2024-09-10', '07:40', '15:30', 'daily', 'select', 0, '2024-09-10 05:13:58', '2024-09-10 05:13:58');

-- --------------------------------------------------------

--
-- Table structure for table `availabilty_appoitment_types`
--

CREATE TABLE `availabilty_appoitment_types` (
  `id` int(11) NOT NULL,
  `availabilty_id` int(11) NOT NULL,
  `appoitment_type` int(11) NOT NULL,
  `created_at` varchar(20) NOT NULL,
  `updated_at` varchar(20) NOT NULL
) ENGINE=InnoDB DEFAULT CHARSET=latin1;

--
-- Dumping data for table `availabilty_appoitment_types`
--

INSERT INTO `availabilty_appoitment_types` (`id`, `availabilty_id`, `appoitment_type`, `created_at`, `updated_at`) VALUES
(2, 1, 19, '2023-11-08 14:55:54', '2023-11-08 14:55:54'),
(3, 2, 19, '2023-11-14 13:19:30', '2023-11-14 13:19:30'),
(7, 9, 21, '2024-02-01 09:01:03', '2024-02-01 09:01:03'),
(8, 10, 25, '2024-03-12 12:55:54', '2024-03-12 12:55:54'),
(9, 4, 20, '2024-03-27 11:07:03', '2024-03-27 11:07:03'),
(18, 6, 20, '2024-05-06 06:52:40', '2024-05-06 06:52:40'),
(39, 12, 20, '2024-05-06 06:56:21', '2024-05-06 06:56:21'),
(40, 12, 21, '2024-05-06 06:56:21', '2024-05-06 06:56:21'),
(41, 12, 22, '2024-05-06 06:56:21', '2024-05-06 06:56:21'),
(42, 12, 23, '2024-05-06 06:56:21', '2024-05-06 06:56:21'),
(43, 12, 24, '2024-05-06 06:56:21', '2024-05-06 06:56:21'),
(44, 12, 25, '2024-05-06 06:56:21', '2024-05-06 06:56:21'),
(45, 13, 20, '2024-05-27 06:30:07', '2024-05-27 06:30:07'),
(46, 13, 21, '2024-05-27 06:30:08', '2024-05-27 06:30:08'),
(47, 13, 22, '2024-05-27 06:30:08', '2024-05-27 06:30:08'),
(48, 13, 23, '2024-05-27 06:30:08', '2024-05-27 06:30:08'),
(49, 13, 24, '2024-05-27 06:30:08', '2024-05-27 06:30:08'),
(50, 13, 25, '2024-05-27 06:30:08', '2024-05-27 06:30:08'),
(52, 16, 20, '2024-06-17 06:22:45', '2024-06-17 06:22:45'),
(53, 16, 21, '2024-06-17 06:22:45', '2024-06-17 06:22:45'),
(55, 18, 21, '2024-06-19 07:24:16', '2024-06-19 07:24:16'),
(57, 19, 20, '2024-07-04 12:20:00', '2024-07-04 12:20:00'),
(68, 22, 21, '2024-08-20 10:15:23', '2024-08-20 10:15:23'),
(69, 23, 21, '2024-08-20 10:15:24', '2024-08-20 10:15:24'),
(74, 21, 20, '2024-08-27 05:34:39', '2024-08-27 05:34:39'),
(79, 25, 20, '2024-08-28 09:22:16', '2024-08-28 09:22:16'),
(80, 25, 21, '2024-08-28 09:22:16', '2024-08-28 09:22:16'),
(81, 25, 22, '2024-08-28 09:22:16', '2024-08-28 09:22:16'),
(82, 25, 23, '2024-08-28 09:22:16', '2024-08-28 09:22:16'),
(83, 26, 20, '2024-09-02 05:42:06', '2024-09-02 05:42:06'),
(84, 26, 21, '2024-09-02 05:42:06', '2024-09-02 05:42:06'),
(85, 26, 22, '2024-09-02 05:42:06', '2024-09-02 05:42:06'),
(86, 28, 20, '2024-09-10 05:13:58', '2024-09-10 05:13:58'),
(87, 28, 21, '2024-09-10 05:13:58', '2024-09-10 05:13:58'),
(88, 28, 22, '2024-09-10 05:13:58', '2024-09-10 05:13:58'),
(89, 28, 23, '2024-09-10 05:13:58', '2024-09-10 05:13:58'),
(90, 28, 24, '2024-09-10 05:13:58', '2024-09-10 05:13:58'),
(91, 28, 25, '2024-09-10 05:13:59', '2024-09-10 05:13:59');

-- --------------------------------------------------------

--
-- Table structure for table `availabilty_remove`
--

CREATE TABLE `availabilty_remove` (
  `id` int(11) NOT NULL,
  `availabilty_id` int(11) NOT NULL,
  `date` varchar(50) NOT NULL,
  `created_at` varchar(20) NOT NULL,
  `updated_at` varchar(20) NOT NULL
) ENGINE=InnoDB DEFAULT CHARSET=latin1;

--
-- Dumping data for table `availabilty_remove`
--

INSERT INTO `availabilty_remove` (`id`, `availabilty_id`, `date`, `created_at`, `updated_at`) VALUES
(1, 4, '2024-01-17', '2024-01-21 18:16:20', '2024-01-21 18:16:20'),
(2, 6, '2024-04-12', '2024-04-10 13:21:19', '2024-04-10 13:21:19'),
(3, 6, '2024-04-09', '2024-04-10 13:21:24', '2024-04-10 13:21:24'),
(4, 6, '2024-04-10', '2024-04-10 13:21:31', '2024-04-10 13:21:31'),
(5, 19, '2024-07-02', '2024-07-03 06:58:32', '2024-07-03 06:58:32'),
(6, 19, '2024-07-07', '2024-07-03 06:58:48', '2024-07-03 06:58:48'),
(7, 19, '2024-07-06', '2024-07-03 06:58:54', '2024-07-03 06:58:54'),
(8, 19, '2024-07-05', '2024-07-03 06:59:00', '2024-07-03 06:59:00'),
(9, 19, '2024-07-04', '2024-07-03 06:59:12', '2024-07-03 06:59:12');

-- --------------------------------------------------------

--
-- Table structure for table `availabilty_resources`
--

CREATE TABLE `availabilty_resources` (
  `id` int(11) NOT NULL,
  `availabilty_id` int(11) NOT NULL,
  `resource` int(11) NOT NULL,
  `created_at` varchar(20) NOT NULL,
  `updated_at` varchar(20) NOT NULL
) ENGINE=InnoDB DEFAULT CHARSET=latin1;

--
-- Dumping data for table `availabilty_resources`
--

INSERT INTO `availabilty_resources` (`id`, `availabilty_id`, `resource`, `created_at`, `updated_at`) VALUES
(1, 1, 29, '2023-11-08 14:55:54', '2023-11-08 14:55:54'),
(2, 2, 29, '2023-11-14 13:19:30', '2023-11-14 13:19:30'),
(3, 3, 29, '2023-12-22 06:49:54', '2023-12-22 06:49:54'),
(7, 7, 64, '2024-01-20 20:15:45', '2024-01-20 20:15:45'),
(8, 8, 64, '2024-01-21 18:55:26', '2024-01-21 18:55:26'),
(9, 9, 64, '2024-02-01 09:01:03', '2024-02-01 09:01:03'),
(10, 10, 61, '2024-03-12 12:55:54', '2024-03-12 12:55:54'),
(11, 4, 61, '2024-03-27 11:07:03', '2024-03-27 11:07:03'),
(12, 11, 64, '2024-04-15 09:09:56', '2024-04-15 09:09:56'),
(14, 6, 29, '2024-05-06 06:52:39', '2024-05-06 06:52:39'),
(18, 12, 64, '2024-05-06 06:56:21', '2024-05-06 06:56:21'),
(19, 13, 61, '2024-05-27 06:30:07', '2024-05-27 06:30:07'),
(20, 14, 29, '2024-06-13 20:56:37', '2024-06-13 20:56:37'),
(22, 16, 61, '2024-06-17 06:22:45', '2024-06-17 06:22:45'),
(24, 18, 61, '2024-06-19 07:24:16', '2024-06-19 07:24:16'),
(26, 19, 29, '2024-07-04 12:20:00', '2024-07-04 12:20:00'),
(27, 19, 90, '2024-07-04 12:20:00', '2024-07-04 12:20:00'),
(28, 19, 91, '2024-07-04 12:20:00', '2024-07-04 12:20:00'),
(38, 22, 29, '2024-08-20 10:15:23', '2024-08-20 10:15:23'),
(39, 23, 29, '2024-08-20 10:15:23', '2024-08-20 10:15:23'),
(43, 24, 96, '2024-08-23 11:43:01', '2024-08-23 11:43:01'),
(45, 21, 93, '2024-08-27 05:34:39', '2024-08-27 05:34:39'),
(50, 25, 29, '2024-08-28 09:22:16', '2024-08-28 09:22:16'),
(51, 26, 29, '2024-09-02 05:42:06', '2024-09-02 05:42:06'),
(52, 26, 99, '2024-09-02 05:42:06', '2024-09-02 05:42:06'),
(53, 26, 100, '2024-09-02 05:42:06', '2024-09-02 05:42:06'),
(54, 27, 29, '2024-09-09 14:10:13', '2024-09-09 14:10:13'),
(55, 28, 29, '2024-09-10 05:13:58', '2024-09-10 05:13:58');

-- --------------------------------------------------------

--
-- Table structure for table `botox_bocouture_settings`
--

CREATE TABLE `botox_bocouture_settings` (
  `id` int(11) NOT NULL,
  `brand_name` varchar(255) COLLATE utf8_unicode_ci DEFAULT NULL,
  `brand_color` varchar(255) COLLATE utf8_unicode_ci DEFAULT NULL,
  `number_input_1` varchar(50) COLLATE utf8_unicode_ci NOT NULL,
  `number_input_2` varchar(50) COLLATE utf8_unicode_ci NOT NULL,
  `number_input_3` varchar(50) COLLATE utf8_unicode_ci NOT NULL,
  `number_input_4` varchar(50) COLLATE utf8_unicode_ci NOT NULL,
  `number_input_5` varchar(50) COLLATE utf8_unicode_ci NOT NULL,
  `number_input_6` varchar(50) COLLATE utf8_unicode_ci NOT NULL,
  `number_input_7` varchar(50) COLLATE utf8_unicode_ci NOT NULL,
  `number_input_8` varchar(50) COLLATE utf8_unicode_ci NOT NULL,
  `created_at` timestamp NULL DEFAULT NULL ON UPDATE CURRENT_TIMESTAMP,
  `updated_at` timestamp NULL DEFAULT NULL
) ENGINE=InnoDB DEFAULT CHARSET=utf8 COLLATE=utf8_unicode_ci;

-- --------------------------------------------------------

--
-- Table structure for table `botox_boxes`
--

CREATE TABLE `botox_boxes` (
  `id` int(11) NOT NULL,
  `botox_id` int(11) NOT NULL,
  `number` varchar(50) COLLATE utf8_unicode_ci NOT NULL
) ENGINE=InnoDB DEFAULT CHARSET=utf8 COLLATE=utf8_unicode_ci;

-- --------------------------------------------------------

--
-- Table structure for table `cards`
--

CREATE TABLE `cards` (
  `id` int(11) NOT NULL,
  `client_id` bigint(20) NOT NULL,
  `type` varchar(255) NOT NULL,
  `doctor` int(11) NOT NULL,
  `specialism` varchar(255) NOT NULL,
  `medical_diagnosis` varchar(255) NOT NULL,
  `ICD_10_diagnosis` varchar(255) NOT NULL,
  `subtrajectdiagnose` varchar(255) NOT NULL,
  `medical_procedures` varchar(255) DEFAULT NULL,
  `subtraject_nummer` varchar(255) NOT NULL,
  `zorgtraject_nummer` bigint(20) NOT NULL,
  `zorg_type` varchar(255) NOT NULL,
  `expected_care_product` varchar(255) NOT NULL,
  `start_date` varchar(255) NOT NULL,
  `end_date` varchar(255) NOT NULL,
  `closed_date` varchar(255) DEFAULT NULL,
  `no_of_days` varchar(255) NOT NULL,
  `status` varchar(255) NOT NULL,
  `created_at` timestamp NULL DEFAULT NULL,
  `updated_at` timestamp NULL DEFAULT NULL
) ENGINE=InnoDB DEFAULT CHARSET=latin1;

--
-- Dumping data for table `cards`
--

INSERT INTO `cards` (`id`, `client_id`, `type`, `doctor`, `specialism`, `medical_diagnosis`, `ICD_10_diagnosis`, `subtrajectdiagnose`, `medical_procedures`, `subtraject_nummer`, `zorgtraject_nummer`, `zorg_type`, `expected_care_product`, `start_date`, `end_date`, `closed_date`, `no_of_days`, `status`, `created_at`, `updated_at`) VALUES
(22, 27, 'Zorgtype_11', 1, '2', '18', '18', '18', 'a:3:{i:0;s:3:\"521\";i:1;s:3:\"518\";i:2;s:3:\"517\";}', '8973320546', 5660385132, '4', 'a:1:{i:0;s:1:\"3\";}', '2024-08-17 11:53:53', '2024-11-15 11:53:53', '2024-08-09 11:54:22', '90', 'closed', '2024-08-09 06:23:53', '2024-08-19 23:10:25'),
(23, 23, 'Zorgtype_11', 1, '2', '12', '12', '12', 'a:1:{i:0;s:3:\"509\";}', '4427744722', 8700115442, '2', 'a:1:{i:0;s:1:\"2\";}', '2024-01-01 05:40:06', '2024-03-31 05:40:06', NULL, '90', 'completed', '2024-08-13 00:10:07', '2024-08-13 00:10:07'),
(24, 23, 'Zorgtype_21', 1, '2', '12', '12', '12', 'a:1:{i:0;s:3:\"508\";}', '2598810982', 8700115442, '2', 'a:1:{i:0;s:1:\"2\";}', '2024-03-31 05:40:06', '2024-07-30 05:40:06', NULL, '120', 'completed', '2024-08-13 00:10:07', '2024-08-13 03:36:37'),
(25, 23, 'Zorgtype_21', 1, '2', '12', '12', '12', 'N;', '1498089293', 8700115442, '2', 'a:1:{i:0;s:1:\"2\";}', '2024-07-30 05:40:06', '2024-11-28 05:40:06', NULL, '120', 'active', '2024-08-13 00:10:07', '2024-08-13 00:11:49'),
(26, 119, 'Zorgtype_11', 1, '2', '12', '12', '12', 'N;', '6667106142', 8279363040, '2', 'a:1:{i:0;s:1:\"3\";}', '2024-08-13 05:45:19', '2024-11-11 05:45:19', NULL, '90', 'active', '2024-08-13 00:15:20', '2024-08-13 00:15:20'),
(27, 27, 'Zorgtype_11', 1, '2', '12', '12', '12', 'a:3:{i:0;s:3:\"516\";i:1;s:3:\"523\";i:2;s:3:\"535\";}', '5127398561', 3478108995, '2', 'a:1:{i:0;s:1:\"2\";}', '2023-10-01 09:04:54', '2023-12-30 09:04:54', NULL, '90', 'completed', '2024-08-14 03:34:54', '2024-08-21 02:01:47'),
(28, 27, 'Zorgtype_21', 1, '2', '12', '12', '12', 'a:6:{i:0;s:3:\"511\";i:1;s:3:\"535\";i:2;s:3:\"540\";i:3;s:3:\"541\";i:4;s:3:\"542\";i:5;s:3:\"543\";}', '4063852877', 3478108995, '2', 'a:1:{i:0;s:1:\"2\";}', '2023-12-30 09:04:54', '2024-04-29 09:04:54', NULL, '120', 'completed', '2024-08-14 03:34:54', '2024-08-21 04:18:22'),
(29, 27, 'Zorgtype_21', 1, '2', '12', '12', '12', 'a:4:{i:0;s:3:\"501\";i:1;s:3:\"532\";i:2;s:3:\"533\";i:3;s:3:\"535\";}', '4675164388', 3478108995, '2', 'a:1:{i:0;s:1:\"2\";}', '2024-04-29 09:04:54', '2024-08-28 09:04:54', '2024-08-16 20:06:16', '120', 'closed', '2024-08-14 03:34:54', '2024-08-21 02:01:47'),
(30, 106, 'Zorgtype_11', 1, '2', '12', '12', '12', 'a:2:{i:0;s:3:\"504\";i:1;s:3:\"503\";}', '9504637171', 4888401482, '2', 'a:1:{i:0;s:1:\"3\";}', '2023-11-18 09:47:57', '2024-02-16 09:47:57', NULL, '90', 'completed', '2024-08-14 04:17:57', '2024-08-16 03:52:33'),
(31, 106, 'Zorgtype_21', 1, '2', '12', '12', '12', 'a:2:{i:0;s:3:\"504\";i:1;s:3:\"513\";}', '9376271410', 4888401482, '2', 'a:1:{i:0;s:1:\"3\";}', '2024-02-16 09:47:57', '2024-06-16 09:47:57', NULL, '120', 'completed', '2024-08-14 04:17:58', '2024-08-14 04:57:39'),
(32, 106, 'Zorgtype_21', 1, '2', '12', '12', '12', 'a:1:{i:0;s:3:\"504\";}', '9934368038', 4888401482, '2', 'a:1:{i:0;s:1:\"3\";}', '2024-06-16 09:47:57', '2024-10-15 09:47:57', '2024-08-14 10:09:59', '120', 'closed', '2024-08-14 04:17:58', '2024-08-14 04:39:59'),
(33, 106, 'Zorgtype_11', 1, '2', '25', '25', '25', 'a:1:{i:0;s:3:\"505\";}', '4784409417', 6957437384, '2', 'a:1:{i:0;s:1:\"2\";}', '2023-02-08 10:15:08', '2023-05-09 10:15:08', NULL, '90', 'completed', '2024-08-14 04:45:08', '2024-08-14 05:21:29'),
(34, 106, 'Zorgtype_21', 1, '2', '25', '25', '25', 'a:1:{i:0;s:3:\"505\";}', '4519513560', 6957437384, '2', 'a:1:{i:0;s:1:\"2\";}', '2023-05-09 10:15:08', '2023-09-07 10:15:08', NULL, '120', 'completed', '2024-08-14 04:45:09', '2024-08-14 05:15:29'),
(35, 106, 'Zorgtype_21', 1, '2', '25', '25', '25', 'a:1:{i:0;s:3:\"505\";}', '1213646418', 6957437384, '2', 'a:1:{i:0;s:1:\"2\";}', '2023-09-07 10:15:08', '2024-01-06 10:15:08', NULL, '120', 'completed', '2024-08-14 04:45:09', '2024-08-14 05:18:08'),
(36, 106, 'Zorgtype_21', 1, '2', '25', '25', '25', 'a:1:{i:0;s:3:\"505\";}', '8501105539', 6957437384, '2', 'a:1:{i:0;s:1:\"2\";}', '2024-01-06 10:15:08', '2024-05-06 10:15:08', NULL, '120', 'completed', '2024-08-14 04:45:09', '2024-08-14 04:45:09'),
(37, 106, 'Zorgtype_21', 1, '2', '25', '25', '25', 'a:2:{i:0;s:3:\"514\";i:1;s:3:\"505\";}', '2015148954', 6957437384, '2', 'a:1:{i:0;s:1:\"2\";}', '2024-05-06 10:15:08', '2024-09-04 10:15:08', NULL, '120', 'active', '2024-08-14 04:45:09', '2024-08-14 05:13:31'),
(38, 34, 'Zorgtype_11', 1, '2', '12', '12', '12', 'a:1:{i:0;s:3:\"515\";}', '1405074292', 1463308396, '2', 'a:1:{i:0;s:1:\"3\";}', '2024-08-14 11:22:42', '2024-11-12 11:22:42', NULL, '90', 'active', '2024-08-14 05:52:42', '2024-08-14 06:00:11'),
(39, 27, 'Zorgtype_11', 1, '2', '19', '19', '19', 'a:3:{i:1;s:3:\"522\";i:2;s:3:\"521\";i:3;s:3:\"535\";}', '3854811569', 4579300052, '2', 'a:1:{i:0;s:1:\"2\";}', '2024-08-16 20:06:58', '2024-11-14 20:06:58', '2024-08-30 11:51:58', '90', 'closed', '2024-08-16 14:36:58', '2024-08-30 06:21:58'),
(40, 102, 'Zorgtype_11', 1, '2', '19', '19', '19', 'a:3:{i:0;s:3:\"526\";i:1;s:3:\"528\";i:2;s:3:\"529\";}', '6931280215', 2326891373, '3', 'a:1:{i:0;s:1:\"3\";}', '2023-04-05 10:18:09', '2023-07-04 10:18:09', NULL, '90', 'completed', '2024-08-20 04:48:09', '2024-08-20 04:57:30'),
(41, 102, 'Zorgtype_11', 1, '2', '19', '19', '19', 'a:1:{i:0;s:3:\"526\";}', '6931280215', 2326891373, '3', 'a:1:{i:0;s:1:\"3\";}', '2023-04-05 10:18:10', '2023-07-04 10:18:10', NULL, '90', 'completed', '2024-08-20 04:48:10', '2024-08-20 04:48:10'),
(42, 102, 'Zorgtype_21', 1, '2', '19', '19', '19', 'a:1:{i:0;s:3:\"526\";}', '1689062227', 2326891373, '3', 'a:1:{i:0;s:1:\"3\";}', '2023-07-04 10:18:10', '2023-11-02 10:18:10', NULL, '120', 'completed', '2024-08-20 04:48:11', '2024-08-20 04:48:11'),
(43, 102, 'Zorgtype_21', 1, '2', '19', '19', '19', 'a:1:{i:0;s:3:\"526\";}', '7168659483', 2326891373, '3', 'a:1:{i:0;s:1:\"3\";}', '2023-11-02 10:18:10', '2024-03-02 10:18:10', NULL, '120', 'completed', '2024-08-20 04:48:11', '2024-08-20 04:48:11'),
(44, 102, 'Zorgtype_21', 1, '2', '19', '19', '19', 'a:1:{i:0;s:3:\"526\";}', '5921366688', 2326891373, '3', 'a:1:{i:0;s:1:\"3\";}', '2024-03-02 10:18:10', '2024-07-01 10:18:10', NULL, '120', 'completed', '2024-08-20 04:48:12', '2024-08-20 04:48:12'),
(45, 102, 'Zorgtype_21', 1, '2', '19', '19', '19', 'a:1:{i:0;s:3:\"526\";}', '8713558917', 2326891373, '3', 'a:1:{i:0;s:1:\"3\";}', '2024-07-01 10:18:10', '2024-10-30 10:18:10', NULL, '120', 'active', '2024-08-20 04:48:12', '2024-08-20 04:48:33'),
(46, 13, 'Zorgtype_11', 1, '2', '12', '12', '12', 'N;', '8360058719', 9073996951, '2', 'a:1:{i:0;s:1:\"3\";}', '2024-08-27 19:04:52', '2024-11-25 19:04:52', NULL, '90', 'active', '2024-08-27 13:34:53', '2024-08-27 13:34:53'),
(47, 123, 'Zorgtype_11', 1, '2', '18', '18', '18', 'a:1:{i:0;s:3:\"549\";}', '3575406804', 4214548209, '2', 'a:1:{i:0;s:1:\"2\";}', '2024-08-28 09:47:59', '2024-11-26 09:47:59', NULL, '90', 'active', '2024-08-28 04:17:59', '2024-08-28 04:17:59'),
(48, 124, 'Zorgtype_11', 1, '2', '12', '12', '12', 'a:1:{i:0;s:3:\"552\";}', '2178474747', 6352648245, '2', 'a:1:{i:0;s:1:\"2\";}', '2024-08-27 12:26:02', '2024-11-25 12:26:02', NULL, '90', 'active', '2024-08-28 06:56:02', '2024-08-28 06:56:02'),
(49, 27, 'Zorgtype_11', 1, '2', '12', '12', '12', 'a:2:{i:0;s:3:\"548\";i:1;s:3:\"523\";}', '8835141362', 9568833102, '2', 'a:1:{i:0;s:1:\"2\";}', '2024-08-14 11:52:25', '2024-11-12 11:52:25', NULL, '90', 'active', '2024-08-30 06:22:25', '2024-08-31 13:47:15'),
(50, 121, 'Zorgtype_11', 1, '2', '12', '12', '12', 'a:1:{i:0;s:3:\"554\";}', '6473237543', 4305228523, '2', 'a:1:{i:0;s:1:\"2\";}', '2024-09-02 12:39:13', '2024-12-01 12:39:13', NULL, '90', 'active', '2024-09-02 07:09:13', '2024-09-02 07:09:13');

-- --------------------------------------------------------

--
-- Table structure for table `care_processes`
--

CREATE TABLE `care_processes` (
  `id` int(11) NOT NULL,
  `title` varchar(255) NOT NULL,
  `duration` varchar(255) NOT NULL,
  `created_at` timestamp NULL DEFAULT NULL,
  `updated_at` timestamp NULL DEFAULT NULL
) ENGINE=InnoDB DEFAULT CHARSET=latin1;

--
-- Dumping data for table `care_processes`
--

INSERT INTO `care_processes` (`id`, `title`, `duration`, `created_at`, `updated_at`) VALUES
(2, '11 Reguliere zorg', '90 days', '2024-01-29 05:46:54', '2024-05-22 23:03:28'),
(3, '21 Vervolg', '120 days', '2024-01-29 05:47:05', '2024-06-19 11:05:16'),
(4, '41 Derden/ Eerstlijn OVP', '01 days', '2024-05-30 06:54:12', '2024-06-19 11:05:05');

-- --------------------------------------------------------

--
-- Table structure for table `cashes`
--

CREATE TABLE `cashes` (
  `id` int(11) NOT NULL,
  `cash_date` date NOT NULL,
  `cash_amount` varchar(50) NOT NULL,
  `created_at` timestamp NULL DEFAULT NULL ON UPDATE CURRENT_TIMESTAMP,
  `updated_at` timestamp NULL DEFAULT NULL
) ENGINE=InnoDB DEFAULT CHARSET=latin1;

-- --------------------------------------------------------

--
-- Table structure for table `categories`
--

CREATE TABLE `categories` (
  `id` int(11) NOT NULL,
  `treatment_id` int(11) NOT NULL,
  `title` varchar(255) COLLATE utf8_unicode_ci NOT NULL,
  `created_at` varchar(20) COLLATE utf8_unicode_ci NOT NULL,
  `updated_at` varchar(20) COLLATE utf8_unicode_ci NOT NULL
) ENGINE=InnoDB DEFAULT CHARSET=utf8 COLLATE=utf8_unicode_ci;

-- --------------------------------------------------------

--
-- Table structure for table `clients`
--

CREATE TABLE `clients` (
  `id` int(11) NOT NULL,
  `added_by` int(11) NOT NULL,
  `client_number` varchar(20) NOT NULL,
  `gender` varchar(20) NOT NULL,
  `name` varchar(200) NOT NULL,
  `last_name` varchar(200) NOT NULL,
  `dob` varchar(50) NOT NULL,
  `street` varchar(255) NOT NULL,
  `postcode` varchar(20) NOT NULL,
  `place` varchar(255) NOT NULL,
  `country` varchar(50) NOT NULL,
  `email` varchar(50) NOT NULL,
  `telephone` varchar(20) NOT NULL,
  `image` varchar(200) NOT NULL,
  `status` enum('1','0') NOT NULL,
  `created_at` timestamp NULL DEFAULT NULL,
  `updated_at` timestamp NULL DEFAULT NULL,
  `location` varchar(255) DEFAULT NULL,
  `ssn` varchar(50) NOT NULL,
  `town` varchar(255) NOT NULL,
  `subscribe` int(11) NOT NULL DEFAULT '1'
) ENGINE=InnoDB DEFAULT CHARSET=latin1;

--
-- Dumping data for table `clients`
--

INSERT INTO `clients` (`id`, `added_by`, `client_number`, `gender`, `name`, `last_name`, `dob`, `street`, `postcode`, `place`, `country`, `email`, `telephone`, `image`, `status`, `created_at`, `updated_at`, `location`, `ssn`, `town`, `subscribe`) VALUES
(1, 1, '2362733', 'Mr.', 'Taruna', 'Thakur', '16/05/2000', 'Marktstraat 1', '5611 EA', '', 'Netherlands', 'taruna-thakur@csgroupchd.com', '0402370300', '', '1', '2023-10-11 01:42:07', '2024-01-25 02:15:09', 'Hoofddorp - (Locatie Markenburg 147, Ingang: La costa, Zonnebankstudio, Gratis parkeren)', '123456', 'Eindhoven, North Brabant', 1),
(10, 1, '3437477', 'Mrs.', 'Riya', 'Jha', '03/10/2023', 'E300', '16000', '', 'Netherlands', 'anurag.lyall@csgroupchd.com', '9685945612', '', '1', '2023-10-11 05:35:41', '2024-01-25 04:10:00', 'Hoofddorp - (Locatie Markenburg 147, Ingang: La costa, Zonnebankstudio, Gratis parkeren)', '23262562', 'chandigarh', 1),
(13, 1, '3847343', 'Mrs.', 'Nilofar', 'Vincken', '07/06/1990', 'Marktstraat 1', '5611 EA', '', 'Netherlands', 'Nilofar@yopmail.com', '0615192488', '', '1', '2023-10-12 03:47:07', '2024-01-25 04:10:15', 'Hoofddorp - (Locatie Markenburg 147, Ingang: La costa, Zonnebankstudio, Gratis parkeren)', '4545412', 'Eindhoven', 1),
(23, 1, '9585967', 'Mr.', 'Test', 'Patient', '02/07/1997', 'testnov1', '232222', '', 'Netherlands', 'test1@gmail.com', '56559595', '1712119074Screenshot_3.png', '1', '2023-11-01 01:55:50', '2024-04-02 23:07:54', 'Hoofddorp - (Locatie Markenburg 147, Ingang: La costa, Zonnebankstudio, Gratis parkeren)', '33232233', 'testnov2', 1),
(27, 1, '3302549', 'Mrs.', 'Sonam', 'Bugreja', '01/01/1993', 'Vissedijk 3, 7602', '7602', '', 'Netherlands', 'sonambugreja@cssoftsolutions.com', '713291818', '1721818574png (1).png', '1', '2024-01-25 02:19:05', '2024-07-24 05:26:14', 'Amsterdam', '754545', 'Almelo', 1),
(30, 1, '3454264', 'Mrs.', 'test-antonio34', 'smith34', '01/01/1970', '46th avenue', '160030', '', 'Netherlands', 'tester1143@yopmail.com', '8798797854', '', '1', '2024-01-25 04:30:52', '2024-07-08 01:39:57', 'Amsterdam', '5756756765', 'afafd', 1),
(31, 1, '2350837', 'Mrs.', 'Jansen', 'de Vries', '09/12/2023', 'e3334', '1514541', '', 'Netherlands', 'wereii@fmriri.ml', '6548048484', '1719548364002c4380-3d03-4f78-aeef-1b99ec9021ba_rw_600.jpg', '1', '2024-01-27 06:08:25', '2024-06-27 22:49:24', 'Amsterdam', '123234558451', 'ererer', 1),
(32, 1, '3033088', 'Mr.', 'Jansen', 'de Vrier', '01/01/1970', 'ewewe', '54515', '', 'Netherlands', '34343@gmail.com', '0645151515', '1718616011QA Test.jpg', '1', '2024-01-28 13:33:09', '2024-06-17 03:50:11', 'Amsterdam', '2154115151', 'wewewe', 1),
(33, 1, '5546341', 'Mrs.', 'Paul', 'Paulus', '01/01/1970', '2232323', '232323', '', 'Netherlands', 'eir393i9@gmailderer.com', '2032039203203', '17204183911660759744230.jpg', '1', '2024-02-01 14:08:16', '2024-07-08 00:29:51', 'Amsterdam', '8115484848481', '232323', 1),
(34, 1, '7434835', 'F', 'test', 'test', '13/08/2024', '123street', '8787878', '', 'Netherlands', 'test@yopmail.com', '3454545434', '1719921330Screenshot_3.png', '1', '2024-02-02 01:22:34', '2024-09-02 01:00:33', 'Amsterdam', '123456', 'test', 1),
(42, 1, '5253529', 'Mrs.', 'Robert', 'Downey Jr.', '01/01/1970', '45qyh', '1234 TC', '', 'Netherlands', 'robert@yopmail.com', '904194458', '1720093104Screenshot_3.png', '1', '2024-03-29 02:23:31', '2024-07-04 06:08:24', 'Amsterdam', '465546787989', '4we5h', 1),
(51, 1, '8858547', 'Mr.', 'Test4', 'Test4', '04/02/2024', 'cs', '4567 th', '', 'Netherlands', 'Test4@yopmail.com', '34545', '17205018791660759744230.jpg', '1', '2024-04-23 05:07:52', '2024-07-08 23:41:19', 'Amsterdam', '6666666', 'cs', 1),
(102, 1, '5909275', 'Mrs.', 'test', 'test', '06/10/2024', 'test123', '2121', '', 'Namibia', 'test123@yopmail.com', '8768687686', '', '1', '2024-06-17 01:40:04', '2024-08-21 01:31:42', 'Amsterdam', '213123312313', 'united', 1),
(105, 1, '8415851', 'Mrs.', 'QAtest81', 'QAtest81', '02/01/2024', 'New york', '98568', '', 'United States', 'QAtest81@yopmail.com', '9858965876', '', '1', '2024-06-20 01:40:47', '2024-07-11 04:00:04', 'Amsterdam', '9898989', 'New york', 1),
(106, 1, '5657159', 'Mr.', 'john44', 'Smith44', '06/01/2024', 'New york', '98569', '', 'Australia', 'john44@yopmail.com', '9586987458', '', '1', '2024-06-20 23:26:47', '2024-06-27 01:15:11', 'Amsterdam', '123456789', 'New york', 1),
(109, 1, '2170641', 'Mrs.', 'test', 'test', '07/02/2024', '123uk', '787232', '', 'Nepal', 'shivanisangal@csgroupchd.com', '9434939439', '17200885211660759744230.jpg', '1', '2024-07-04 04:52:01', '2024-07-04 04:52:01', NULL, '9839293', 'uk', 1),
(110, 1, '7909509', 'Mrs.', 'Turner', 'gill', '07/03/2024', '54th avenue', '9581 TX', '', 'Netherlands', 'info@dreamclinics.nl', '9784557810', '', '1', '2024-07-05 07:18:19', '2024-07-05 07:18:19', NULL, '123456', 'Rotterdam', 1),
(111, 1, '1962375', 'Mrs.', 'user', 'test', '07/08/2024', '123uk', '435453', '', 'Marshall Islands', 'testcs@yopmail.com', '3345334534', '', '1', '2024-07-09 05:58:40', '2024-07-09 05:58:40', NULL, '4534535345', 'uk', 1),
(112, 1, '2081815', 'Mrs.', 'test', 'user', '01/01/1970', '123uk', '2565263', '', 'Mongolia', 'userdata@yopmail.com', '9843874343', '17205850441660759744230.jpg', '1', '2024-07-09 22:47:24', '2024-07-09 22:47:24', NULL, '324344343', 'uk', 1),
(118, 1, '2640736', 'Mrs.', 'test01', 'test', '02/01/1995', 'Marktstraat 1', '5611 EA', '', 'Netherlands', 'test01@yopmail.com', '9784557810', '', '1', '2024-07-19 00:06:22', '2024-07-19 00:06:22', NULL, '23262562', 'West en Middelbeers', 1),
(119, 1, '8160107', 'Mrs.', 'guru', 'singh', '01/01/1970', 'rrrrrhrgtr', '1234 dg', '', 'Netherlands', 'gurtej-singh@csgroupchd.com', '45678945', '', '1', '2024-07-26 04:58:20', '2024-08-02 01:57:58', 'Amsterdam', '123456', 'hrtyr', 1),
(121, 1, '1119', 'Mrs.', 'shivani', 'test', '25/09/2020', '123 netherland', '2181 HK', '', '', 'shivanisangal@yopmail.com', '767667879797', '', '1', '2024-08-22 00:46:47', '2024-08-22 00:46:47', NULL, '', 'Hillegom', 1),
(123, 1, '6866886', 'Mr.', 'testing cs doctor', 'testing cs doctor', '01/01/1970', 'testcs', '123', '', 'Mauritius', 'testingcs008@yopmail.com', '98761234', '', '1', '2024-08-26 23:42:09', '2024-08-27 06:19:23', 'Amsterdam', '1234', 'testcs', 1),
(124, 1, '7965361', '', 'testcs First', 'test cs demo', '01/01/1970', 'testcs', '123', '', 'Afghanistan', 'testcsdemo009@yopmail.com', '9876123412341234', '', '1', '2024-08-28 05:42:26', '2024-08-28 05:42:26', NULL, '1234', 'testcs', 1),
(125, 1, '8055291', 'Mr.', 'testcs First testcs Last', 'testcs Last', '09/09/2020', 'testcs', '123', '', 'Afghanistan', 'testcs009@yopmail.com', '98765321', '', '1', '2024-08-28 05:57:50', '2024-09-06 01:26:56', NULL, '1234', 'testcs', 1),
(126, 1, '9139252', '', 'testcs 29', 'testcs29', '01/01/1970', 'testcs Street', '1234', '', 'Mauritius', 'testcs8029@yopmail.com', '9876123400', '', '1', '2024-08-29 00:03:19', '2024-08-29 00:03:19', NULL, '1234', 'testcs', 1),
(127, 1, '3556425', 'Mr.', 'testcs  Worlist', 'testcs Worlist', '09/01/2024', '1234', '1234', '', 'Mauritius', 'testcsworklist04@yopmail.com', '9876123412', '', '1', '2024-09-04 00:59:10', '2024-09-04 00:59:10', NULL, '123', 'testcs', 1),
(128, 1, '1127', 'Mr.', 'testcs  testing', 'testcs testing', '09/02/2024', 'testcs testing', '123', '', '', 'testcs9006@yopmail.com', '9876532100', '', '1', '2024-09-06 01:29:14', '2024-09-06 01:29:14', NULL, '', 'testcs testing', 1),
(129, 1, '1128', 'Mr.', 'testcs', 'testcs doctor', '06/09/2024', 'testcs doctor', '1234', '', '', 'testcsdoctor90006@yopmail.com', '9876532100', '', '1', '2024-09-06 01:32:14', '2024-09-06 01:32:14', NULL, '', 'testcs doctor', 1),
(130, 1, '1129', 'Mrs.', 'testcs', 'testcs almost', '04/09/2024', 'testcs', '1234', '', '', 'testcsalmost9006@yopmail.com', '9876532100', '', '1', '2024-09-06 02:11:24', '2024-09-06 02:13:24', NULL, '', 'testcs', 1);

-- --------------------------------------------------------

--
-- Table structure for table `client_doctor_pharmacy`
--

CREATE TABLE `client_doctor_pharmacy` (
  `id` bigint(20) UNSIGNED NOT NULL,
  `client_id` int(11) NOT NULL,
  `user_id` bigint(20) UNSIGNED NOT NULL,
  `physician_doctor_id` int(11) NOT NULL DEFAULT '0',
  `pharmacy_id` int(11) NOT NULL DEFAULT '0',
  `insurance_id` int(11) NOT NULL DEFAULT '0',
  `insurance_number` varchar(255) COLLATE utf8mb4_unicode_ci DEFAULT NULL,
  `created_at` timestamp NULL DEFAULT NULL,
  `updated_at` timestamp NULL DEFAULT NULL
) ENGINE=InnoDB DEFAULT CHARSET=utf8mb4 COLLATE=utf8mb4_unicode_ci;

--
-- Dumping data for table `client_doctor_pharmacy`
--

INSERT INTO `client_doctor_pharmacy` (`id`, `client_id`, `user_id`, `physician_doctor_id`, `pharmacy_id`, `insurance_id`, `insurance_number`, `created_at`, `updated_at`) VALUES
(2, 10, 1, 24, 3, 15, '5848484584854', '2023-10-31 04:55:50', '2024-01-20 14:48:19'),
(3, 23, 1, 11, 3, 3, '959959595685944', '2023-11-01 02:05:53', '2024-01-19 03:29:30'),
(5, 1, 1, 11, 10, 4, '4848551514', '2024-01-04 02:13:21', '2024-01-21 13:30:52'),
(8, 31, 1, 24, 3, 6, '25984845', '2024-01-27 06:08:49', '2024-01-27 06:08:49'),
(9, 32, 1, 13, 5, 7, '656216518451', '2024-01-28 13:34:33', '2024-06-13 15:12:42'),
(10, 42, 1, 4, 3, 14, '475896', '2024-03-29 05:47:51', '2024-03-29 05:47:51'),
(21, 34, 1, 2, 4, 0, NULL, '2024-06-14 06:14:18', '2024-06-14 06:14:18'),
(25, 30, 1, 2, 4, 3, '272788272783', '2024-06-17 03:44:40', '2024-06-17 03:44:40'),
(27, 27, 1, 12, 11, 3, '555', '2024-06-21 00:25:03', '2024-08-23 04:27:58'),
(28, 106, 1, 24, 11, 7, '878273823', '2024-06-24 01:27:44', '2024-06-24 01:27:44'),
(29, 33, 1, 13, 5, 1, '65656565', '2024-07-08 00:35:05', '2024-07-09 05:20:36'),
(30, 111, 1, 1, 4, 3, '7676767', '2024-07-09 23:39:13', '2024-07-09 23:39:13'),
(31, 105, 1, 5, 3, 3, '443323232', '2024-07-11 03:38:58', '2024-07-11 03:38:58'),
(33, 123, 1, 36, 21, 20, '1234', '2024-08-27 04:16:06', '2024-08-27 04:21:46'),
(34, 124, 1, 37, 11, 1, '1234456', '2024-08-28 06:00:38', '2024-08-28 06:01:05');

-- --------------------------------------------------------

--
-- Table structure for table `client_id_card`
--

CREATE TABLE `client_id_card` (
  `id` int(11) NOT NULL,
  `user_id` int(11) NOT NULL,
  `client_id` int(11) NOT NULL,
  `file` varchar(255) COLLATE utf8_unicode_ci DEFAULT NULL,
  `created_at` varchar(20) COLLATE utf8_unicode_ci NOT NULL,
  `updated_at` varchar(20) COLLATE utf8_unicode_ci NOT NULL
) ENGINE=InnoDB DEFAULT CHARSET=utf8 COLLATE=utf8_unicode_ci;

--
-- Dumping data for table `client_id_card`
--

INSERT INTO `client_id_card` (`id`, `user_id`, `client_id`, `file`, `created_at`, `updated_at`) VALUES
(2, 1, 23, '1720095925master-card.png', '2023-10-20 10:13:30', '2024-07-04 12:25:25'),
(17, 1, 23, '', '2023-12-22 07:13:09', '2023-12-22 07:13:09'),
(18, 1, 23, '', '2023-12-22 07:13:22', '2023-12-22 07:13:22'),
(19, 1, 14, '', '2023-12-22 07:55:08', '2023-12-22 09:20:25'),
(20, 1, 9, '1703236050shutterstock_542948338.jpg', '2023-12-22 08:00:24', '2023-12-22 09:07:30'),
(22, 1, 13, '1703236976shutterstock_266818631-300x300.jpg', '2023-12-22 09:22:31', '2023-12-22 09:22:56'),
(23, 1, 53, '1716270378tese.jpg', '2024-05-21 05:46:18', '2024-05-21 05:46:18'),
(24, 1, 55, '', '2024-05-27 05:56:33', '2024-05-27 11:34:35'),
(25, 1, 51, '', '2024-05-27 10:27:38', '2024-06-11 09:54:03'),
(26, 1, 46, '1717149516sample-10s-1700577012024-1701173231473.png', '2024-05-31 09:58:36', '2024-05-31 09:58:36'),
(27, 53, 57, '', '2024-06-03 10:59:55', '2024-06-03 11:49:03'),
(28, 1, 58, '1717561512QA Test.jpg', '2024-06-05 04:24:51', '2024-06-05 04:25:12'),
(29, 1, 65, '1718274289QA Test.jpg', '2024-06-07 07:23:03', '2024-06-13 10:24:49'),
(30, 1, 106, '17192123021660759744230.jpg', '2024-06-24 06:58:22', '2024-06-24 06:58:22'),
(31, 1, 105, '17200743621660759744230.jpg', '2024-07-04 06:26:02', '2024-07-04 06:26:02');

-- --------------------------------------------------------

--
-- Table structure for table `client_informed_consents`
--

CREATE TABLE `client_informed_consents` (
  `id` bigint(20) UNSIGNED NOT NULL,
  `user_id` int(11) NOT NULL,
  `client_id` int(11) NOT NULL,
  `informed_consent_id` int(11) NOT NULL,
  `doctor` varchar(255) COLLATE utf8mb4_unicode_ci NOT NULL,
  `treatment_date` varchar(255) COLLATE utf8mb4_unicode_ci NOT NULL,
  `location` varchar(255) COLLATE utf8mb4_unicode_ci NOT NULL,
  `sign_consent_file` varchar(255) COLLATE utf8mb4_unicode_ci NOT NULL,
  `created_at` timestamp NULL DEFAULT NULL,
  `updated_at` timestamp NULL DEFAULT NULL
) ENGINE=InnoDB DEFAULT CHARSET=utf8mb4 COLLATE=utf8mb4_unicode_ci;

--
-- Dumping data for table `client_informed_consents`
--

INSERT INTO `client_informed_consents` (`id`, `user_id`, `client_id`, `informed_consent_id`, `doctor`, `treatment_date`, `location`, `sign_consent_file`, `created_at`, `updated_at`) VALUES
(48, 1, 23, 1, 'Doctor Test', '25/01/2024', 'Hoofddorp - (Locatie Markenburg 147, Ingang: La costa, Zonnebankstudio, Gratis parkeren)', 'b3d08d0a8037091797501d043a617d13.png', '2024-01-15 06:06:39', '2024-01-15 06:06:39'),
(49, 1, 23, 12, 'Doctor Test', '26/01/2024', 'Hoofddorp - (Locatie Markenburg 147, Ingang: La costa, Zonnebankstudio, Gratis parkeren)', 'b6d3ff2627183fb6d0aaa4ea02cef8e1.png', '2024-01-15 06:06:57', '2024-01-15 06:06:57'),
(50, 1, 23, 1, 'Doctor Test', '23/01/2024', 'Hoofddorp - (Locatie Markenburg 147, Ingang: La costa, Zonnebankstudio, Gratis parkeren)', 'fe33902d512c6ef386e27a2d93b79dc0.png', '2024-01-15 06:07:18', '2024-01-15 06:07:18'),
(51, 1, 23, 1, 'Doctor Test', '23/01/2024', 'Hoofddorp - (Locatie Markenburg 147, Ingang: La costa, Zonnebankstudio, Gratis parkeren)', '240b491944d2fcad37047de9bff259d4.png', '2024-01-15 06:09:01', '2024-01-15 06:09:01'),
(52, 1, 23, 1, 'Gurtej singh', '15/01/2024', 'Hoofddorp - (Locatie Markenburg 147, Ingang: La costa, Zonnebankstudio, Gratis parkeren)', 'd4ee83c174d0042f87889735f229fb80.png', '2024-01-15 06:09:54', '2024-01-15 06:09:54'),
(53, 1, 23, 1, 'Doctor Test', '16/01/2024', 'Hoofddorp - (Locatie Markenburg 147, Ingang: La costa, Zonnebankstudio, Gratis parkeren)', '9c6e93908ba22350040a6aefac7502b9.png', '2024-01-16 00:15:17', '2024-01-16 00:15:17'),
(54, 1, 23, 1, 'Doctor Test', '16/01/2024', 'Hoofddorp - (Locatie Markenburg 147, Ingang: La costa, Zonnebankstudio, Gratis parkeren)', '22eb3fc89cd1123b1afebac77db8b471.png', '2024-01-16 00:16:48', '2024-01-16 00:16:48'),
(55, 1, 23, 12, 'Doctor Test', '16/01/2024', 'Hoofddorp - (Locatie Markenburg 147, Ingang: La costa, Zonnebankstudio, Gratis parkeren)', '878acb8117fe879d51090b43dda697e9.png', '2024-01-16 00:16:50', '2024-01-16 00:16:50'),
(56, 1, 23, 17, 'Doctor Test', '20/01/2024', 'Hoofddorp - (Locatie Markenburg 147, Ingang: La costa, Zonnebankstudio, Gratis parkeren)', '298ecc84412867c3036f1a5ad4e4bdaa.png', '2024-01-20 14:33:43', '2024-01-20 14:33:43'),
(57, 1, 10, 17, 'Doctor Test', '20/01/2024', 'Hoofddorp - (Locatie Markenburg 147, Ingang: La costa, Zonnebankstudio, Gratis parkeren)', '9cf27c93d683425e3d34ad57731e59a4.png', '2024-01-20 14:58:50', '2024-01-20 14:58:50'),
(58, 1, 23, 18, 'George Tokmaji', '31/01/2024', 'Hoofddorp - (Locatie Markenburg 147, Ingang: La costa, Zonnebankstudio, Gratis parkeren)', '11bec24a5ceca5c97c5f867842dbe0fd.png', '2024-01-22 04:03:33', '2024-01-22 04:03:33'),
(59, 1, 23, 12, 'Doctor Test', '31/01/2024', 'Hoofddorp - (Locatie Markenburg 147, Ingang: La costa, Zonnebankstudio, Gratis parkeren)', 'df232df8940bf402c38122b87dd1e043.png', '2024-01-22 04:03:48', '2024-01-22 04:03:48'),
(60, 1, 23, 18, 'George Tokmaji', '24/01/2024', 'Hoofddorp - (Locatie Markenburg 147, Ingang: La costa, Zonnebankstudio, Gratis parkeren)', '467d0bd9bb9ba0bfa97169471aa7693d.png', '2024-01-22 04:04:03', '2024-01-22 04:04:03'),
(61, 1, 23, 1, 'Gurtej singh', '22/01/2024', 'Hoofddorp - (Locatie Markenburg 147, Ingang: La costa, Zonnebankstudio, Gratis parkeren)', '27dab245a744ff43a220d740ff428ae7.png', '2024-01-22 04:04:18', '2024-01-22 04:04:18'),
(62, 1, 23, 1, 'Doctor Test', '09/01/2024', 'Hoofddorp - (Locatie Markenburg 147, Ingang: La costa, Zonnebankstudio, Gratis parkeren)', '5b568cf1d0540a1153824dd81d3c3b7d.png', '2024-01-22 04:13:41', '2024-01-22 04:13:41'),
(63, 1, 32, 17, 'George Tokmaji', '28/01/2024', 'Delft - (Locatie Olof Palmestraat 20, Ingang: Hairtec, Haarkliniek, Gratis parkeren)', '8d471028329a0bb17235cc590a9d0cf3.png', '2024-01-28 13:47:12', '2024-01-28 13:47:12'),
(64, 1, 34, 17, 'Doctor Test', '14/02/2024', 'Hoofddorp - (Locatie Markenburg 147, Ingang: La costa, Zonnebankstudio, Gratis parkeren)', '6448087e0803bca5bad06cbbd976d5af.png', '2024-02-14 07:09:42', '2024-02-14 07:09:42'),
(65, 1, 34, 17, 'Doctor Test', '20/02/2024', 'Hoofddorp - (Locatie Markenburg 147, Ingang: La costa, Zonnebankstudio, Gratis parkeren)', '5dd9b88c21ace87a236d49fad2662b94.png', '2024-02-20 01:17:48', '2024-02-20 01:17:48'),
(66, 1, 34, 17, 'Gurtej singh', '22/02/2024', 'Hoofddorp - (Locatie Markenburg 147, Ingang: La costa, Zonnebankstudio, Gratis parkeren)', '0c277069df776dfa0df0530c45c17785.png', '2024-02-22 06:10:10', '2024-02-22 06:10:10'),
(67, 1, 34, 18, 'Gurtej singh', '22/02/2024', 'Hoofddorp - (Locatie Markenburg 147, Ingang: La costa, Zonnebankstudio, Gratis parkeren)', '2c25915e25af63b070616d2be464476f.png', '2024-02-22 06:10:12', '2024-02-22 06:10:12'),
(68, 1, 34, 19, 'Doctor Test', '27/02/2024', 'Hoofddorp - (Locatie Markenburg 147, Ingang: La costa, Zonnebankstudio, Gratis parkeren)', 'c83e77e95c4a95ede234adb5a32f2bd7.png', '2024-02-27 00:15:49', '2024-02-27 00:15:49'),
(69, 1, 34, 19, 'Doctor Test', '27/02/2024', 'Hoofddorp - (Locatie Markenburg 147, Ingang: La costa, Zonnebankstudio, Gratis parkeren)', '1309f08c463d3e5364681278809aef20.png', '2024-02-27 00:17:50', '2024-02-27 00:17:50'),
(70, 1, 34, 19, 'Doctor Test', '27/02/2024', 'Hoofddorp - (Locatie Markenburg 147, Ingang: La costa, Zonnebankstudio, Gratis parkeren)', '13ddd1c803d5214c4bff572e6a7e0970.png', '2024-02-27 02:04:37', '2024-02-27 02:04:37'),
(71, 1, 40, 17, 'Doctor Test', '27/03/2024', 'Hoofddorp - (Locatie Markenburg 147, Ingang: La costa, Zonnebankstudio, Gratis parkeren)', '697af37c2b182b8bf1d93d77a47495a5.png', '2024-03-27 00:15:16', '2024-03-27 00:15:16'),
(72, 1, 51, 17, 'Doctor Test', '29/04/2024', 'Hoofddorp - (Locatie Markenburg 147, Ingang: La costa, Zonnebankstudio, Gratis parkeren)', 'b9bf06ed2f7e46dd612e6ec4d4890125.png', '2024-04-29 00:13:06', '2024-04-29 00:13:06'),
(73, 1, 53, 17, 'Gurtej singh', '03/05/2024', 'Hoofddorp - (Locatie Markenburg 147, Ingang: La costa, Zonnebankstudio, Gratis parkeren)', '01503ba1b9f4766dc38961f9e1ca0ee7.png', '2024-05-03 00:57:14', '2024-05-03 00:57:14'),
(74, 1, 53, 17, 'Doctor Test', '06/05/2024', 'Hoofddorp - (Locatie Markenburg 147, Ingang: La costa, Zonnebankstudio, Gratis parkeren)', 'd2e96490c8d229050c60eae8b1facbda.png', '2024-05-06 05:12:51', '2024-05-06 05:12:51'),
(75, 1, 53, 19, 'paul a smith', '07/05/2024', 'Hoofddorp - (Locatie Markenburg 147, Ingang: La costa, Zonnebankstudio, Gratis parkeren)', 'a7f5de32614609ea357bddd9fb74c89a.png', '2024-05-07 03:25:09', '2024-05-07 03:25:09'),
(76, 1, 53, 21, 'Gurtej singh', '07/05/2024', 'Hoofddorp - (Locatie Markenburg 147, Ingang: La costa, Zonnebankstudio, Gratis parkeren)', '7c73fc2431e6fb3446305cdb16eef1b3.png', '2024-05-07 06:14:08', '2024-05-07 06:14:08'),
(77, 1, 53, 17, 'Gurtej singh', '09/05/2024', 'Hoofddorp - (Locatie Markenburg 147, Ingang: La costa, Zonnebankstudio, Gratis parkeren)', 'c3121cf861da04c3526e800a710843fb.png', '2024-05-08 23:22:02', '2024-05-08 23:22:02'),
(78, 1, 53, 18, 'Gurtej singh', '09/05/2024', 'Hoofddorp - (Locatie Markenburg 147, Ingang: La costa, Zonnebankstudio, Gratis parkeren)', 'bb221ee8b889fb0e59efcaf301802dee.png', '2024-05-08 23:22:04', '2024-05-08 23:22:04'),
(79, 1, 53, 19, 'Gurtej singh', '09/05/2024', 'Hoofddorp - (Locatie Markenburg 147, Ingang: La costa, Zonnebankstudio, Gratis parkeren)', 'a1b771e9a7c96e54709bd4499554d412.png', '2024-05-08 23:22:06', '2024-05-08 23:22:06'),
(80, 1, 53, 20, 'Gurtej singh', '09/05/2024', 'Hoofddorp - (Locatie Markenburg 147, Ingang: La costa, Zonnebankstudio, Gratis parkeren)', 'cc847fad4e29ed7d3d7f4923f321d357.png', '2024-05-08 23:22:08', '2024-05-08 23:22:08'),
(81, 1, 53, 21, 'Gurtej singh', '09/05/2024', 'Hoofddorp - (Locatie Markenburg 147, Ingang: La costa, Zonnebankstudio, Gratis parkeren)', '7e7700d1c7a94c9becdeaeaf7dbbcada.png', '2024-05-08 23:22:11', '2024-05-08 23:22:11'),
(82, 1, 53, 22, 'Gurtej singh', '09/05/2024', 'Hoofddorp - (Locatie Markenburg 147, Ingang: La costa, Zonnebankstudio, Gratis parkeren)', 'df89baf0b89ee20c551a316d759f003d.png', '2024-05-08 23:22:13', '2024-05-08 23:22:13'),
(83, 1, 53, 17, 'paul a smith', '09/05/2024', 'Hoofddorp - (Locatie Markenburg 147, Ingang: La costa, Zonnebankstudio, Gratis parkeren)', '36b09aca03a5f52585aa8c844692b7b5.png', '2024-05-08 23:23:03', '2024-05-08 23:23:03'),
(84, 1, 53, 19, 'Gurtej singh', '09/05/2024', 'Hoofddorp - (Locatie Markenburg 147, Ingang: La costa, Zonnebankstudio, Gratis parkeren)', 'ede5743bca6dc07a86344cfa8a6eb7c6.png', '2024-05-08 23:23:58', '2024-05-08 23:23:58'),
(85, 1, 31, 17, 'Gurtej singh', '09/05/2024', 'Hoofddorp - (Locatie Markenburg 147, Ingang: La costa, Zonnebankstudio, Gratis parkeren)', 'f42c700a17a37b3d7af05e395eb020f4.png', '2024-05-09 06:55:27', '2024-05-09 06:55:27'),
(86, 78, 53, 17, 'Sonam Bugreja', '13/05/2024', 'Hoofddorp - (Locatie Markenburg 147, Ingang: La costa, Zonnebankstudio, Gratis parkeren)', '340fa427b15c0e564643fb3e0f9079e7.png', '2024-05-13 00:47:15', '2024-05-13 00:47:15'),
(87, 1, 51, 17, 'Gurtej singh', '27/05/2024', 'Hoofddorp - (Locatie Markenburg 147, Ingang: La costa, Zonnebankstudio, Gratis parkeren)', '5deacdc89bc5264a5b16d310bf322177.png', '2024-05-27 01:55:26', '2024-05-27 01:55:26'),
(88, 1, 51, 18, 'Gurtej singh', '27/05/2024', 'Hoofddorp - (Locatie Markenburg 147, Ingang: La costa, Zonnebankstudio, Gratis parkeren)', '3cbd83e6be67a3b1d53d119ce034eefd.png', '2024-05-27 01:55:28', '2024-05-27 01:55:28'),
(89, 1, 51, 17, 'Gurtej singh', '27/05/2024', 'Hoofddorp - (Locatie Markenburg 147, Ingang: La costa, Zonnebankstudio, Gratis parkeren)', '3cbd83e6be67a3b1d53d119ce034eefd.png', '2024-05-27 01:55:28', '2024-05-27 01:55:28'),
(90, 1, 51, 21, 'Gurtej singh', '27/05/2024', 'Hoofddorp - (Locatie Markenburg 147, Ingang: La costa, Zonnebankstudio, Gratis parkeren)', '9a1992c28ec643196e9604f63e9c4495.png', '2024-05-27 01:55:30', '2024-05-27 01:55:30'),
(91, 1, 51, 18, 'Gurtej singh', '27/05/2024', 'Hoofddorp - (Locatie Markenburg 147, Ingang: La costa, Zonnebankstudio, Gratis parkeren)', '9a1992c28ec643196e9604f63e9c4495.png', '2024-05-27 01:55:30', '2024-05-27 01:55:30'),
(92, 1, 51, 21, 'Gurtej singh', '27/05/2024', 'Hoofddorp - (Locatie Markenburg 147, Ingang: La costa, Zonnebankstudio, Gratis parkeren)', '0203b43d30aa0cc8c199454d7604681f.png', '2024-05-27 01:55:32', '2024-05-27 01:55:32'),
(93, 1, 51, 17, 'Gurtej singh', '27/05/2024', 'Hoofddorp - (Locatie Markenburg 147, Ingang: La costa, Zonnebankstudio, Gratis parkeren)', '1f87571e07558453897a67f2de0e029a.png', '2024-05-27 01:55:34', '2024-05-27 01:55:34'),
(94, 1, 51, 17, 'Gurtej singh', '27/05/2024', 'Hoofddorp - (Locatie Markenburg 147, Ingang: La costa, Zonnebankstudio, Gratis parkeren)', '1f87571e07558453897a67f2de0e029a.png', '2024-05-27 01:55:34', '2024-05-27 01:55:34'),
(95, 1, 51, 17, 'Gurtej singh', '27/05/2024', 'Hoofddorp - (Locatie Markenburg 147, Ingang: La costa, Zonnebankstudio, Gratis parkeren)', '1f87571e07558453897a67f2de0e029a.png', '2024-05-27 01:55:34', '2024-05-27 01:55:34'),
(96, 1, 51, 17, 'Gurtej singh', '27/05/2024', 'Hoofddorp - (Locatie Markenburg 147, Ingang: La costa, Zonnebankstudio, Gratis parkeren)', '1a5f3a95e12c42e4779ba391b7789473.png', '2024-05-27 01:55:35', '2024-05-27 01:55:35'),
(97, 1, 51, 17, 'Gurtej singh', '27/05/2024', 'Hoofddorp - (Locatie Markenburg 147, Ingang: La costa, Zonnebankstudio, Gratis parkeren)', 'cf00327518e98a7ac086f4bff0bd36db.png', '2024-05-27 01:55:36', '2024-05-27 01:55:36'),
(98, 1, 51, 18, 'Gurtej singh', '27/05/2024', 'Hoofddorp - (Locatie Markenburg 147, Ingang: La costa, Zonnebankstudio, Gratis parkeren)', 'cf00327518e98a7ac086f4bff0bd36db.png', '2024-05-27 01:55:36', '2024-05-27 01:55:36'),
(99, 1, 51, 18, 'Gurtej singh', '27/05/2024', 'Hoofddorp - (Locatie Markenburg 147, Ingang: La costa, Zonnebankstudio, Gratis parkeren)', 'cf00327518e98a7ac086f4bff0bd36db.png', '2024-05-27 01:55:36', '2024-05-27 01:55:36'),
(100, 1, 51, 18, 'Gurtej singh', '27/05/2024', 'Hoofddorp - (Locatie Markenburg 147, Ingang: La costa, Zonnebankstudio, Gratis parkeren)', 'cf00327518e98a7ac086f4bff0bd36db.png', '2024-05-27 01:55:36', '2024-05-27 01:55:36'),
(101, 1, 51, 18, 'Gurtej singh', '27/05/2024', 'Hoofddorp - (Locatie Markenburg 147, Ingang: La costa, Zonnebankstudio, Gratis parkeren)', '4d4e85f4e2835adf6b3345f17a9f9917.png', '2024-05-27 01:55:37', '2024-05-27 01:55:37'),
(102, 1, 51, 18, 'Gurtej singh', '27/05/2024', 'Hoofddorp - (Locatie Markenburg 147, Ingang: La costa, Zonnebankstudio, Gratis parkeren)', '5b781de0506591e1d4c39c4d3d708603.png', '2024-05-27 01:55:38', '2024-05-27 01:55:38'),
(103, 1, 51, 21, 'Gurtej singh', '27/05/2024', 'Hoofddorp - (Locatie Markenburg 147, Ingang: La costa, Zonnebankstudio, Gratis parkeren)', '5b781de0506591e1d4c39c4d3d708603.png', '2024-05-27 01:55:38', '2024-05-27 01:55:38'),
(104, 1, 51, 21, 'Gurtej singh', '27/05/2024', 'Hoofddorp - (Locatie Markenburg 147, Ingang: La costa, Zonnebankstudio, Gratis parkeren)', '5b781de0506591e1d4c39c4d3d708603.png', '2024-05-27 01:55:38', '2024-05-27 01:55:38'),
(105, 1, 51, 21, 'Gurtej singh', '27/05/2024', 'Hoofddorp - (Locatie Markenburg 147, Ingang: La costa, Zonnebankstudio, Gratis parkeren)', '5b781de0506591e1d4c39c4d3d708603.png', '2024-05-27 01:55:38', '2024-05-27 01:55:38'),
(106, 1, 51, 21, 'Gurtej singh', '27/05/2024', 'Hoofddorp - (Locatie Markenburg 147, Ingang: La costa, Zonnebankstudio, Gratis parkeren)', '1fb900ff294f2f36abb6740102e7f6e8.png', '2024-05-27 01:55:39', '2024-05-27 01:55:39'),
(107, 1, 51, 17, 'Gurtej singh', '27/05/2024', 'Hoofddorp - (Locatie Markenburg 147, Ingang: La costa, Zonnebankstudio, Gratis parkeren)', 'c0b14d4cc640c78642f3ce8b1efba0f2.png', '2024-05-27 01:55:40', '2024-05-27 01:55:40'),
(108, 1, 51, 21, 'Gurtej singh', '27/05/2024', 'Hoofddorp - (Locatie Markenburg 147, Ingang: La costa, Zonnebankstudio, Gratis parkeren)', 'c0b14d4cc640c78642f3ce8b1efba0f2.png', '2024-05-27 01:55:40', '2024-05-27 01:55:40'),
(109, 1, 51, 17, 'Gurtej singh', '27/05/2024', 'Hoofddorp - (Locatie Markenburg 147, Ingang: La costa, Zonnebankstudio, Gratis parkeren)', 'f45afa40d5667f4f818cf1c511ee84e2.png', '2024-05-27 01:55:41', '2024-05-27 01:55:41'),
(110, 1, 51, 17, 'Gurtej singh', '27/05/2024', 'Hoofddorp - (Locatie Markenburg 147, Ingang: La costa, Zonnebankstudio, Gratis parkeren)', 'f45afa40d5667f4f818cf1c511ee84e2.png', '2024-05-27 01:55:41', '2024-05-27 01:55:41'),
(111, 1, 51, 17, 'Gurtej singh', '27/05/2024', 'Hoofddorp - (Locatie Markenburg 147, Ingang: La costa, Zonnebankstudio, Gratis parkeren)', 'f45afa40d5667f4f818cf1c511ee84e2.png', '2024-05-27 01:55:41', '2024-05-27 01:55:41'),
(112, 1, 51, 18, 'Gurtej singh', '27/05/2024', 'Hoofddorp - (Locatie Markenburg 147, Ingang: La costa, Zonnebankstudio, Gratis parkeren)', '4f165ad4bf905c2c42821bc704fd991d.png', '2024-05-27 01:55:42', '2024-05-27 01:55:42'),
(113, 1, 51, 18, 'Gurtej singh', '27/05/2024', 'Hoofddorp - (Locatie Markenburg 147, Ingang: La costa, Zonnebankstudio, Gratis parkeren)', '1d286cc8a8d2c3010f8771f60fe3f2ea.png', '2024-05-27 01:55:43', '2024-05-27 01:55:43'),
(114, 1, 51, 18, 'Gurtej singh', '27/05/2024', 'Hoofddorp - (Locatie Markenburg 147, Ingang: La costa, Zonnebankstudio, Gratis parkeren)', '1d286cc8a8d2c3010f8771f60fe3f2ea.png', '2024-05-27 01:55:43', '2024-05-27 01:55:43'),
(115, 1, 51, 18, 'Gurtej singh', '27/05/2024', 'Hoofddorp - (Locatie Markenburg 147, Ingang: La costa, Zonnebankstudio, Gratis parkeren)', '1d286cc8a8d2c3010f8771f60fe3f2ea.png', '2024-05-27 01:55:43', '2024-05-27 01:55:43'),
(116, 1, 51, 21, 'Gurtej singh', '27/05/2024', 'Hoofddorp - (Locatie Markenburg 147, Ingang: La costa, Zonnebankstudio, Gratis parkeren)', '917954f17dd8aba4ebb42f19a279a5b9.png', '2024-05-27 01:55:45', '2024-05-27 01:55:45'),
(117, 1, 51, 21, 'Gurtej singh', '27/05/2024', 'Hoofddorp - (Locatie Markenburg 147, Ingang: La costa, Zonnebankstudio, Gratis parkeren)', '917954f17dd8aba4ebb42f19a279a5b9.png', '2024-05-27 01:55:45', '2024-05-27 01:55:45'),
(118, 1, 51, 21, 'Gurtej singh', '27/05/2024', 'Hoofddorp - (Locatie Markenburg 147, Ingang: La costa, Zonnebankstudio, Gratis parkeren)', '917954f17dd8aba4ebb42f19a279a5b9.png', '2024-05-27 01:55:45', '2024-05-27 01:55:45'),
(119, 1, 51, 21, 'Gurtej singh', '27/05/2024', 'Hoofddorp - (Locatie Markenburg 147, Ingang: La costa, Zonnebankstudio, Gratis parkeren)', 'ad777a45810470fbc2900f3cefe64abd.png', '2024-05-27 01:55:46', '2024-05-27 01:55:46'),
(120, 53, 57, 17, 'Doctor Test', '03/06/2024', 'Hoofddorp - (Locatie Markenburg 147, Ingang: La costa, Zonnebankstudio, Gratis parkeren)', 'e2e9efb40a3bd946269ac6bfebdbe7d5.png', '2024-06-03 05:46:17', '2024-06-03 05:46:17'),
(121, 53, 57, 18, 'Doctor Test', '03/06/2024', 'Hoofddorp - (Locatie Markenburg 147, Ingang: La costa, Zonnebankstudio, Gratis parkeren)', '8c60306e965320fc2213417b56e0fd5f.png', '2024-06-03 05:46:19', '2024-06-03 05:46:19'),
(122, 53, 57, 19, 'Doctor Test', '03/06/2024', 'Hoofddorp - (Locatie Markenburg 147, Ingang: La costa, Zonnebankstudio, Gratis parkeren)', 'd4b3a7ed1708abd37f9c168d2bcccc27.png', '2024-06-03 05:46:21', '2024-06-03 05:46:21'),
(123, 53, 57, 20, 'Doctor Test', '03/06/2024', 'Hoofddorp - (Locatie Markenburg 147, Ingang: La costa, Zonnebankstudio, Gratis parkeren)', 'e63949a24f355dcb4617fcf56f32e1bd.png', '2024-06-03 05:46:23', '2024-06-03 05:46:23'),
(124, 53, 57, 21, 'Doctor Test', '03/06/2024', 'Hoofddorp - (Locatie Markenburg 147, Ingang: La costa, Zonnebankstudio, Gratis parkeren)', '8df98ac7a66072d5e359088a9d1fa52d.png', '2024-06-03 05:46:25', '2024-06-03 05:46:25'),
(125, 53, 57, 22, 'Doctor Test', '03/06/2024', 'Hoofddorp - (Locatie Markenburg 147, Ingang: La costa, Zonnebankstudio, Gratis parkeren)', 'b340684dc31f5ecd9f262f66f296b4e0.png', '2024-06-03 05:46:27', '2024-06-03 05:46:27'),
(133, 1, 68, 17, 'Sonam Bugreja', '29/06/2024', 'Hoofddorp - (Locatie Markenburg 147, Ingang: La costa, Zonnebankstudio, Gratis parkeren)', 'ba70e9db967254b655813b7343b8f964.png', '2024-06-12 00:13:15', '2024-06-12 00:13:15'),
(134, 1, 68, 18, 'Sonam Bugreja', '29/06/2024', 'Hoofddorp - (Locatie Markenburg 147, Ingang: La costa, Zonnebankstudio, Gratis parkeren)', 'd4f9b9e62744b11a0fdb21e1360e8f55.png', '2024-06-12 00:13:17', '2024-06-12 00:13:17'),
(135, 1, 68, 19, 'Sonam Bugreja', '29/06/2024', 'Hoofddorp - (Locatie Markenburg 147, Ingang: La costa, Zonnebankstudio, Gratis parkeren)', 'a0070b5942b769077f96219f0cbc5b4f.png', '2024-06-12 00:13:19', '2024-06-12 00:13:19'),
(136, 1, 68, 20, 'Sonam Bugreja', '29/06/2024', 'Hoofddorp - (Locatie Markenburg 147, Ingang: La costa, Zonnebankstudio, Gratis parkeren)', '840f27762b8e540760ef48f206b74343.png', '2024-06-12 00:13:21', '2024-06-12 00:13:21'),
(137, 1, 68, 21, 'Sonam Bugreja', '29/06/2024', 'Hoofddorp - (Locatie Markenburg 147, Ingang: La costa, Zonnebankstudio, Gratis parkeren)', '4c30862827656be610e76d7650fd6b5c.png', '2024-06-12 00:13:23', '2024-06-12 00:13:23'),
(138, 1, 68, 22, 'Sonam Bugreja', '29/06/2024', 'Hoofddorp - (Locatie Markenburg 147, Ingang: La costa, Zonnebankstudio, Gratis parkeren)', '48b4fe24c7a7a97ac8dff95c0ceea9a6.png', '2024-06-12 00:13:25', '2024-06-12 00:13:25'),
(139, 1, 68, 17, 'Sonam Bugreja', '29/06/2024', 'Hoofddorp - (Locatie Markenburg 147, Ingang: La costa, Zonnebankstudio, Gratis parkeren)', 'c9ac5e06c4e52e869fc06ad18582c351.png', '2024-06-12 00:13:26', '2024-06-12 00:13:26'),
(140, 1, 68, 18, 'Sonam Bugreja', '29/06/2024', 'Hoofddorp - (Locatie Markenburg 147, Ingang: La costa, Zonnebankstudio, Gratis parkeren)', '0d2899440feebd05a137f1b957d8dea6.png', '2024-06-12 00:13:28', '2024-06-12 00:13:28'),
(141, 1, 68, 19, 'Sonam Bugreja', '29/06/2024', 'Hoofddorp - (Locatie Markenburg 147, Ingang: La costa, Zonnebankstudio, Gratis parkeren)', 'c4e675b8f77223f4f7fe6cff24a9779c.png', '2024-06-12 00:13:30', '2024-06-12 00:13:30'),
(142, 1, 68, 20, 'Sonam Bugreja', '29/06/2024', 'Hoofddorp - (Locatie Markenburg 147, Ingang: La costa, Zonnebankstudio, Gratis parkeren)', '89674811707405b24382c9243acdbc33.png', '2024-06-12 00:13:32', '2024-06-12 00:13:32'),
(143, 1, 68, 21, 'Sonam Bugreja', '29/06/2024', 'Hoofddorp - (Locatie Markenburg 147, Ingang: La costa, Zonnebankstudio, Gratis parkeren)', '7e0f92c4702424d0087e1e9da7cf1fac.png', '2024-06-12 00:13:34', '2024-06-12 00:13:34'),
(144, 1, 68, 22, 'Sonam Bugreja', '29/06/2024', 'Hoofddorp - (Locatie Markenburg 147, Ingang: La costa, Zonnebankstudio, Gratis parkeren)', 'ccf09d51958c959b07af2e0816a6f122.png', '2024-06-12 00:13:36', '2024-06-12 00:13:36'),
(145, 1, 34, 17, 'Gurtej singh', '12/06/2024', 'Hoofddorp - (Locatie Markenburg 147, Ingang: La costa, Zonnebankstudio, Gratis parkeren)', 'a1b342f7d2472473cf3b35aea2ec2e7b.png', '2024-06-12 00:17:34', '2024-06-12 00:17:34'),
(146, 1, 67, 19, 'Gurtej singh', '12/06/2024', 'Hoofddorp - (Locatie Markenburg 147, Ingang: La costa, Zonnebankstudio, Gratis parkeren)', '64ff6cf7a1fcc35d2777b22e16f573d3.png', '2024-06-12 00:47:50', '2024-06-12 00:47:50'),
(147, 1, 68, 19, 'Gurtej singh', '13/06/2024', 'Hoofddorp - (Locatie Markenburg 147, Ingang: La costa, Zonnebankstudio, Gratis parkeren)', '3dc4741a2e723d3afbc84a3cd95347fc.png', '2024-06-12 23:58:35', '2024-06-12 23:58:35'),
(148, 1, 32, 17, 'Doctor Test', '13/06/2024', 'Hoofddorp - (Locatie Markenburg 147, Ingang: La costa, Zonnebankstudio, Gratis parkeren)', '69456c639e13a12b4f0c3b4d9a5f7430.png', '2024-06-13 15:19:58', '2024-06-13 15:19:58'),
(149, 1, 104, 17, 'Gurtej singh', '28/06/2024', 'Amsterdam', '73c5d32386ed23e16c6c2e54131e5ed2.png', '2024-06-19 00:47:12', '2024-06-19 00:47:12'),
(150, 1, 104, 18, 'Gurtej singh', '28/06/2024', 'Amsterdam', '41c5ff953c73c2bbf2eeebab8d83e697.png', '2024-06-19 00:47:14', '2024-06-19 00:47:14'),
(151, 1, 104, 19, 'Gurtej singh', '28/06/2024', 'Amsterdam', '3c5295dc1058196ce2c24d932935629f.png', '2024-06-19 00:47:16', '2024-06-19 00:47:16'),
(152, 1, 104, 20, 'Gurtej singh', '28/06/2024', 'Amsterdam', '75aa403ea81667c13f5197cfa95876d1.png', '2024-06-19 00:47:18', '2024-06-19 00:47:18'),
(153, 1, 104, 21, 'Gurtej singh', '28/06/2024', 'Amsterdam', '095425d31f43b1e7f03da3f28b6b0a8b.png', '2024-06-19 00:47:20', '2024-06-19 00:47:20'),
(154, 1, 104, 22, 'Gurtej singh', '28/06/2024', 'Amsterdam', '40c308bf24a45f6b106df315b5cd684a.png', '2024-06-19 00:47:22', '2024-06-19 00:47:22'),
(155, 1, 104, 23, 'Gurtej singh', '28/06/2024', 'Amsterdam', 'fd1581efa59994c1a947cf37b4d4d2c7.png', '2024-06-19 00:47:24', '2024-06-19 00:47:24'),
(156, 1, 104, 25, 'Gurtej singh', '28/06/2024', 'Amsterdam', 'e0c022ac08d9df1c251f3017b0674566.png', '2024-06-19 00:47:26', '2024-06-19 00:47:26'),
(157, 1, 16, 17, 'Doctor Test', '18/06/2024', 'Amsterdam', '129c68b764f726cede173115529e0bd0.png', '2024-06-24 06:09:59', '2024-06-24 06:09:59'),
(158, 1, 14, 18, 'Doctor Test', '26/06/2024', 'Amsterdam', '471c70dc6029d59dc3be68e1646351dd.png', '2024-06-26 01:41:01', '2024-06-26 01:41:01'),
(159, 1, 14, 18, 'Doctor Test', '26/06/2024', 'Amsterdam', 'b6e6471f2f343f1e993e377c1a174efe.png', '2024-06-26 01:41:03', '2024-06-26 01:41:03'),
(160, 1, 110, 1, 'Doctor Test', '08/07/2024', 'Amsterdam', 'ab84051a22c2bbcc0dba63b89e0ccdde.png', '2024-07-07 22:53:05', '2024-07-07 22:53:05'),
(161, 1, 110, 1, 'Doctor Test', '08/07/2024', 'Amsterdam', 'b0e6a4d4e2e7546391ae8186d6e6ed52.png', '2024-07-07 22:53:06', '2024-07-07 22:53:06'),
(162, 1, 27, 1, 'test admin', '06/08/2024', 'Amsterdam', 'ff0cdbb9be4cf792ab627eddf55c03e6.png', '2024-08-23 04:27:09', '2024-08-23 04:27:09'),
(163, 1, 122, 1, 'Doctor Test', '23/08/2024', 'Amsterdam', 'e6b409a64bb4a782b3a292452123e2b1.png', '2024-08-23 05:08:08', '2024-08-23 05:08:08'),
(164, 1, 123, 1, 'Doctor Test', '27/08/2024', 'Amsterdam', '89e93849e6b6455a4e6fde7cf2ff6699.png', '2024-08-27 04:56:32', '2024-08-27 04:56:32'),
(165, 1, 123, 1, 'Doctor Test', '27/08/2024', 'Amsterdam', '8e3669896de5836f9de73d86819f4982.png', '2024-08-27 04:56:34', '2024-08-27 04:56:34'),
(166, 1, 123, 12, 'Doctor Test', '27/08/2024', 'Amsterdam', '8e3669896de5836f9de73d86819f4982.png', '2024-08-27 04:56:34', '2024-08-27 04:56:34'),
(167, 1, 123, 1, 'Doctor Test', '27/08/2024', 'Amsterdam', 'c080d24c50f08d74163a645135371ac5.png', '2024-08-27 04:56:35', '2024-08-27 04:56:35'),
(168, 1, 123, 1, 'Doctor Test', '27/08/2024', 'Amsterdam', 'c080d24c50f08d74163a645135371ac5.png', '2024-08-27 04:56:35', '2024-08-27 04:56:35'),
(169, 1, 123, 1, 'Doctor Test', '27/08/2024', 'Amsterdam', '185c42942244ddeead486f920e2f1f5f.png', '2024-08-27 04:56:36', '2024-08-27 04:56:36'),
(170, 1, 123, 12, 'Doctor Test', '27/08/2024', 'Amsterdam', '185c42942244ddeead486f920e2f1f5f.png', '2024-08-27 04:56:36', '2024-08-27 04:56:36'),
(171, 1, 123, 17, 'Doctor Test', '27/08/2024', 'Amsterdam', '185c42942244ddeead486f920e2f1f5f.png', '2024-08-27 04:56:36', '2024-08-27 04:56:36'),
(172, 1, 123, 12, 'Doctor Test', '27/08/2024', 'Amsterdam', '77643bc7136e8ab819c6c3da97c2c87a.png', '2024-08-27 04:56:37', '2024-08-27 04:56:37'),
(173, 1, 123, 12, 'Doctor Test', '27/08/2024', 'Amsterdam', '77643bc7136e8ab819c6c3da97c2c87a.png', '2024-08-27 04:56:37', '2024-08-27 04:56:37'),
(174, 1, 123, 12, 'Doctor Test', '27/08/2024', 'Amsterdam', '3eae67c6031d7b10faa088168495a77d.png', '2024-08-27 04:56:38', '2024-08-27 04:56:38'),
(175, 1, 123, 17, 'Doctor Test', '27/08/2024', 'Amsterdam', '3eae67c6031d7b10faa088168495a77d.png', '2024-08-27 04:56:38', '2024-08-27 04:56:38'),
(176, 1, 123, 18, 'Doctor Test', '27/08/2024', 'Amsterdam', 'd610a33df66c70068f0c0f950c55a173.png', '2024-08-27 04:56:39', '2024-08-27 04:56:39'),
(177, 1, 123, 17, 'Doctor Test', '27/08/2024', 'Amsterdam', 'd610a33df66c70068f0c0f950c55a173.png', '2024-08-27 04:56:39', '2024-08-27 04:56:39'),
(178, 1, 123, 17, 'Doctor Test', '27/08/2024', 'Amsterdam', 'd610a33df66c70068f0c0f950c55a173.png', '2024-08-27 04:56:39', '2024-08-27 04:56:39'),
(179, 1, 123, 17, 'Doctor Test', '27/08/2024', 'Amsterdam', '789db69246b05761be24cea03a77ef37.png', '2024-08-27 04:56:40', '2024-08-27 04:56:40'),
(180, 1, 123, 18, 'Doctor Test', '27/08/2024', 'Amsterdam', '789db69246b05761be24cea03a77ef37.png', '2024-08-27 04:56:40', '2024-08-27 04:56:40'),
(181, 1, 123, 19, 'Doctor Test', '27/08/2024', 'Amsterdam', 'e0c599ae6c657b03c825eadb81660bb0.png', '2024-08-27 04:56:41', '2024-08-27 04:56:41'),
(182, 1, 123, 18, 'Doctor Test', '27/08/2024', 'Amsterdam', 'e0c599ae6c657b03c825eadb81660bb0.png', '2024-08-27 04:56:41', '2024-08-27 04:56:41'),
(183, 1, 123, 18, 'Doctor Test', '27/08/2024', 'Amsterdam', 'e0c599ae6c657b03c825eadb81660bb0.png', '2024-08-27 04:56:41', '2024-08-27 04:56:41'),
(184, 1, 123, 18, 'Doctor Test', '27/08/2024', 'Amsterdam', 'b05f9ae0bb52f79fa6c35d82feac6b29.png', '2024-08-27 04:56:42', '2024-08-27 04:56:42'),
(185, 1, 123, 19, 'Doctor Test', '27/08/2024', 'Amsterdam', 'b05f9ae0bb52f79fa6c35d82feac6b29.png', '2024-08-27 04:56:42', '2024-08-27 04:56:42'),
(186, 1, 123, 22, 'Doctor Test', '27/08/2024', 'Amsterdam', 'ceccf876cc4768bae5e18d4191cad2ee.png', '2024-08-27 04:56:43', '2024-08-27 04:56:43'),
(187, 1, 123, 19, 'Doctor Test', '27/08/2024', 'Amsterdam', 'ceccf876cc4768bae5e18d4191cad2ee.png', '2024-08-27 04:56:43', '2024-08-27 04:56:43'),
(188, 1, 123, 19, 'Doctor Test', '27/08/2024', 'Amsterdam', 'ceccf876cc4768bae5e18d4191cad2ee.png', '2024-08-27 04:56:43', '2024-08-27 04:56:43'),
(189, 1, 123, 19, 'Doctor Test', '27/08/2024', 'Amsterdam', 'd18bd2fab0e59f316887c3742f6e8ff7.png', '2024-08-27 04:56:44', '2024-08-27 04:56:44'),
(190, 1, 123, 22, 'Doctor Test', '27/08/2024', 'Amsterdam', '067d3a9f590b2fd58a435bfbcb247170.png', '2024-08-27 04:56:45', '2024-08-27 04:56:45'),
(191, 1, 123, 23, 'Doctor Test', '27/08/2024', 'Amsterdam', '067d3a9f590b2fd58a435bfbcb247170.png', '2024-08-27 04:56:45', '2024-08-27 04:56:45'),
(192, 1, 123, 22, 'Doctor Test', '27/08/2024', 'Amsterdam', '067d3a9f590b2fd58a435bfbcb247170.png', '2024-08-27 04:56:45', '2024-08-27 04:56:45'),
(193, 1, 123, 22, 'Doctor Test', '27/08/2024', 'Amsterdam', '067d3a9f590b2fd58a435bfbcb247170.png', '2024-08-27 04:56:45', '2024-08-27 04:56:45'),
(194, 1, 123, 22, 'Doctor Test', '27/08/2024', 'Amsterdam', '452d04c683ab1629324e02970ddc9678.png', '2024-08-27 04:56:46', '2024-08-27 04:56:46'),
(195, 1, 123, 23, 'Doctor Test', '27/08/2024', 'Amsterdam', '8d2cdc7b2966ffc4260693b9844bb5e2.png', '2024-08-27 04:56:47', '2024-08-27 04:56:47'),
(196, 1, 123, 24, 'Doctor Test', '27/08/2024', 'Amsterdam', '8d2cdc7b2966ffc4260693b9844bb5e2.png', '2024-08-27 04:56:47', '2024-08-27 04:56:47'),
(197, 1, 123, 23, 'Doctor Test', '27/08/2024', 'Amsterdam', '8d2cdc7b2966ffc4260693b9844bb5e2.png', '2024-08-27 04:56:47', '2024-08-27 04:56:47'),
(198, 1, 123, 23, 'Doctor Test', '27/08/2024', 'Amsterdam', '8d2cdc7b2966ffc4260693b9844bb5e2.png', '2024-08-27 04:56:47', '2024-08-27 04:56:47'),
(199, 1, 123, 23, 'Doctor Test', '27/08/2024', 'Amsterdam', '7c3d4a9e85afc433ff02d822ede6a503.png', '2024-08-27 04:56:48', '2024-08-27 04:56:48'),
(200, 1, 123, 24, 'Doctor Test', '27/08/2024', 'Amsterdam', '59a1b831666d60f4cfdf54cb97fbe38e.png', '2024-08-27 04:56:49', '2024-08-27 04:56:49'),
(201, 1, 123, 1, 'Doctor Test', '27/08/2024', 'Amsterdam', '59a1b831666d60f4cfdf54cb97fbe38e.png', '2024-08-27 04:56:49', '2024-08-27 04:56:49'),
(202, 1, 123, 24, 'Doctor Test', '27/08/2024', 'Amsterdam', '59a1b831666d60f4cfdf54cb97fbe38e.png', '2024-08-27 04:56:49', '2024-08-27 04:56:49'),
(203, 1, 123, 24, 'Doctor Test', '27/08/2024', 'Amsterdam', '59a1b831666d60f4cfdf54cb97fbe38e.png', '2024-08-27 04:56:49', '2024-08-27 04:56:49'),
(204, 1, 123, 24, 'Doctor Test', '27/08/2024', 'Amsterdam', 'b1b21914762cff67a42411023834537f.png', '2024-08-27 04:56:50', '2024-08-27 04:56:50'),
(205, 1, 123, 1, 'Doctor Test', '27/08/2024', 'Amsterdam', '0ab0411b0c30a6a95203e92fa3bbfee0.png', '2024-08-27 04:56:51', '2024-08-27 04:56:51'),
(206, 1, 123, 12, 'Doctor Test', '27/08/2024', 'Amsterdam', '0ab0411b0c30a6a95203e92fa3bbfee0.png', '2024-08-27 04:56:51', '2024-08-27 04:56:51'),
(207, 1, 123, 1, 'Doctor Test', '27/08/2024', 'Amsterdam', '0ab0411b0c30a6a95203e92fa3bbfee0.png', '2024-08-27 04:56:51', '2024-08-27 04:56:51'),
(208, 1, 123, 12, 'Doctor Test', '27/08/2024', 'Amsterdam', 'df57e02f823b347f4bd8f77ffdc97495.png', '2024-08-27 04:56:53', '2024-08-27 04:56:53'),
(209, 1, 123, 17, 'Doctor Test', '27/08/2024', 'Amsterdam', 'df57e02f823b347f4bd8f77ffdc97495.png', '2024-08-27 04:56:53', '2024-08-27 04:56:53'),
(210, 1, 123, 12, 'Doctor Test', '27/08/2024', 'Amsterdam', 'df57e02f823b347f4bd8f77ffdc97495.png', '2024-08-27 04:56:53', '2024-08-27 04:56:53'),
(211, 1, 123, 17, 'Doctor Test', '27/08/2024', 'Amsterdam', '5c65aa7ae53e568daa7bd8c585c45e4b.png', '2024-08-27 04:56:55', '2024-08-27 04:56:55'),
(212, 1, 123, 18, 'Doctor Test', '27/08/2024', 'Amsterdam', '5c65aa7ae53e568daa7bd8c585c45e4b.png', '2024-08-27 04:56:55', '2024-08-27 04:56:55'),
(213, 1, 123, 17, 'Doctor Test', '27/08/2024', 'Amsterdam', '5c65aa7ae53e568daa7bd8c585c45e4b.png', '2024-08-27 04:56:55', '2024-08-27 04:56:55'),
(214, 1, 123, 18, 'Doctor Test', '27/08/2024', 'Amsterdam', '1368c63602d2a20f54ba6052da6f24a7.png', '2024-08-27 04:56:57', '2024-08-27 04:56:57'),
(215, 1, 123, 19, 'Doctor Test', '27/08/2024', 'Amsterdam', '1368c63602d2a20f54ba6052da6f24a7.png', '2024-08-27 04:56:57', '2024-08-27 04:56:57'),
(216, 1, 123, 18, 'Doctor Test', '27/08/2024', 'Amsterdam', '1368c63602d2a20f54ba6052da6f24a7.png', '2024-08-27 04:56:57', '2024-08-27 04:56:57'),
(217, 1, 123, 19, 'Doctor Test', '27/08/2024', 'Amsterdam', '45928e1f1b95cd4113346f9d0866a786.png', '2024-08-27 04:56:59', '2024-08-27 04:56:59'),
(218, 1, 123, 22, 'Doctor Test', '27/08/2024', 'Amsterdam', '45928e1f1b95cd4113346f9d0866a786.png', '2024-08-27 04:56:59', '2024-08-27 04:56:59'),
(219, 1, 123, 19, 'Doctor Test', '27/08/2024', 'Amsterdam', '45928e1f1b95cd4113346f9d0866a786.png', '2024-08-27 04:56:59', '2024-08-27 04:56:59'),
(220, 1, 123, 22, 'Doctor Test', '27/08/2024', 'Amsterdam', '317f71ea74bf4ecba51be1340fd66d76.png', '2024-08-27 04:57:01', '2024-08-27 04:57:01'),
(221, 1, 123, 23, 'Doctor Test', '27/08/2024', 'Amsterdam', '317f71ea74bf4ecba51be1340fd66d76.png', '2024-08-27 04:57:01', '2024-08-27 04:57:01'),
(222, 1, 123, 22, 'Doctor Test', '27/08/2024', 'Amsterdam', '317f71ea74bf4ecba51be1340fd66d76.png', '2024-08-27 04:57:01', '2024-08-27 04:57:01'),
(223, 1, 123, 23, 'Doctor Test', '27/08/2024', 'Amsterdam', '68c210422255a62192dc4b4429ab0a26.png', '2024-08-27 04:57:03', '2024-08-27 04:57:03'),
(224, 1, 123, 24, 'Doctor Test', '27/08/2024', 'Amsterdam', '68c210422255a62192dc4b4429ab0a26.png', '2024-08-27 04:57:03', '2024-08-27 04:57:03'),
(225, 1, 123, 23, 'Doctor Test', '27/08/2024', 'Amsterdam', '68c210422255a62192dc4b4429ab0a26.png', '2024-08-27 04:57:03', '2024-08-27 04:57:03'),
(226, 1, 123, 24, 'Doctor Test', '27/08/2024', 'Amsterdam', 'df061434a8ba82f73e42632c401b9626.png', '2024-08-27 04:57:05', '2024-08-27 04:57:05'),
(227, 1, 123, 24, 'Doctor Test', '27/08/2024', 'Amsterdam', 'df061434a8ba82f73e42632c401b9626.png', '2024-08-27 04:57:05', '2024-08-27 04:57:05'),
(228, 1, 27, 1, 'test hartpunt', '26/08/2024', 'Amsterdam', '020aa3a38c2b1e43d114f8fa45d070de.png', '2024-08-27 05:07:05', '2024-08-27 05:07:05'),
(229, 1, 27, 1, 'test hartpunt', '26/08/2024', 'Amsterdam', '020aa3a38c2b1e43d114f8fa45d070de.png', '2024-08-27 05:07:05', '2024-08-27 05:07:05'),
(230, 1, 27, 1, 'test hartpunt', '26/08/2024', 'Amsterdam', '020aa3a38c2b1e43d114f8fa45d070de.png', '2024-08-27 05:07:05', '2024-08-27 05:07:05'),
(231, 1, 27, 23, 'test hartpunt', '27/08/2024', 'Amsterdam', 'b18414ddf04173cf831c4db993217857.png', '2024-08-27 05:07:18', '2024-08-27 05:07:18'),
(232, 1, 27, 23, 'test hartpunt', '27/08/2024', 'Amsterdam', '92c80163f893ff30975d5cd943f57280.png', '2024-08-27 05:07:19', '2024-08-27 05:07:19'),
(233, 1, 27, 23, 'test hartpunt', '27/08/2024', 'Amsterdam', '92c80163f893ff30975d5cd943f57280.png', '2024-08-27 05:07:19', '2024-08-27 05:07:19'),
(234, 1, 27, 23, 'test hartpunt', '27/08/2024', 'Amsterdam', '92c80163f893ff30975d5cd943f57280.png', '2024-08-27 05:07:19', '2024-08-27 05:07:19'),
(235, 1, 27, 23, 'test hartpunt', '27/08/2024', 'Amsterdam', '2413bab899690fe138a2610777938551.png', '2024-08-27 05:07:20', '2024-08-27 05:07:20'),
(236, 1, 27, 23, 'test hartpunt', '27/08/2024', 'Amsterdam', '2413bab899690fe138a2610777938551.png', '2024-08-27 05:07:20', '2024-08-27 05:07:20'),
(237, 1, 27, 23, 'test hartpunt', '27/08/2024', 'Amsterdam', 'b37be24c0a86609e9c9e6ce4423b9462.png', '2024-08-27 05:07:21', '2024-08-27 05:07:21'),
(238, 1, 27, 23, 'test hartpunt', '27/08/2024', 'Amsterdam', 'b37be24c0a86609e9c9e6ce4423b9462.png', '2024-08-27 05:07:21', '2024-08-27 05:07:21'),
(239, 1, 27, 23, 'test hartpunt', '27/08/2024', 'Amsterdam', 'b37be24c0a86609e9c9e6ce4423b9462.png', '2024-08-27 05:07:21', '2024-08-27 05:07:21'),
(240, 1, 27, 23, 'test hartpunt', '27/08/2024', 'Amsterdam', '938eb972618d14a524b3080bad611583.png', '2024-08-27 05:07:22', '2024-08-27 05:07:22'),
(241, 1, 27, 23, 'test hartpunt', '27/08/2024', 'Amsterdam', '938eb972618d14a524b3080bad611583.png', '2024-08-27 05:07:22', '2024-08-27 05:07:22'),
(242, 1, 27, 1, 'test hartpunt', '26/08/2024', 'Amsterdam', '7ca8a710e38e926da99d9a5b9e4e1347.png', '2024-08-27 05:07:37', '2024-08-27 05:07:37'),
(243, 1, 27, 1, 'test hartpunt', '26/08/2024', 'Amsterdam', 'cc63c34c9a8505941e58f528147873b1.png', '2024-08-27 05:07:38', '2024-08-27 05:07:38'),
(244, 1, 27, 1, 'test hartpunt', '26/08/2024', 'Amsterdam', 'cc63c34c9a8505941e58f528147873b1.png', '2024-08-27 05:07:38', '2024-08-27 05:07:38'),
(245, 1, 27, 1, 'test hartpunt', '26/08/2024', 'Amsterdam', 'cc63c34c9a8505941e58f528147873b1.png', '2024-08-27 05:07:38', '2024-08-27 05:07:38'),
(246, 1, 27, 1, 'test hartpunt', '26/08/2024', 'Amsterdam', '0173a2095ee2879684008eec687e6b20.png', '2024-08-27 05:07:39', '2024-08-27 05:07:39'),
(247, 1, 27, 1, 'test hartpunt', '26/08/2024', 'Amsterdam', '60c4aeb111fb8743b7311c0929e5edc8.png', '2024-08-27 05:07:40', '2024-08-27 05:07:40'),
(248, 1, 27, 1, 'Doctor Test', '27/08/2024', 'Amsterdam', '3aa74cbb9a1d3ac276bb39a61e6c3cbb.png', '2024-08-27 05:11:08', '2024-08-27 05:11:08'),
(249, 1, 27, 1, 'Doctor Test', '27/08/2024', 'Amsterdam', 'f30b3f8a4a17d1d22bfb73214640444c.png', '2024-08-27 05:11:09', '2024-08-27 05:11:09'),
(250, 1, 27, 1, 'Doctor Test', '27/08/2024', 'Amsterdam', '39645c6c9cbf12decad1b11a96675dc3.png', '2024-08-27 05:11:10', '2024-08-27 05:11:10'),
(251, 1, 27, 1, 'Doctor Test', '27/08/2024', 'Amsterdam', '39645c6c9cbf12decad1b11a96675dc3.png', '2024-08-27 05:11:10', '2024-08-27 05:11:10'),
(252, 1, 27, 1, 'Doctor234 Gill', '27/08/2024', 'Amsterdam', 'b33ffc66e17cf2e2f3e80230a8072559.png', '2024-08-27 05:15:07', '2024-08-27 05:15:07'),
(253, 1, 27, 1, 'Doctor234 Gill', '27/08/2024', 'Amsterdam', 'dbf5ee53c10bff59a1924d3761423209.png', '2024-08-27 05:15:08', '2024-08-27 05:15:08'),
(254, 1, 23, 12, 'Derek Dwars', '28/08/2024', 'Amsterdam', 'f294ab612b04f9634f9390a8368a0d42.png', '2024-08-28 04:20:46', '2024-08-28 04:20:46'),
(255, 1, 124, 1, 'Doctor Test', '27/08/2024', 'Amsterdam', 'c82b3b2196015c3d6c1c53be903dfd21.png', '2024-08-28 06:59:19', '2024-08-28 06:59:19');

-- --------------------------------------------------------

--
-- Table structure for table `client_orders`
--

CREATE TABLE `client_orders` (
  `id` bigint(20) UNSIGNED NOT NULL,
  `title` varchar(255) COLLATE utf8mb4_unicode_ci NOT NULL,
  `priority` varchar(255) COLLATE utf8mb4_unicode_ci NOT NULL,
  `description` text COLLATE utf8mb4_unicode_ci NOT NULL,
  `date` varchar(255) COLLATE utf8mb4_unicode_ci NOT NULL,
  `user_id` int(11) NOT NULL,
  `client_id` int(11) NOT NULL,
  `order_user_id` int(11) NOT NULL,
  `type` varchar(255) COLLATE utf8mb4_unicode_ci NOT NULL,
  `time` varchar(255) COLLATE utf8mb4_unicode_ci NOT NULL,
  `status` varchar(255) COLLATE utf8mb4_unicode_ci NOT NULL,
  `created_at` timestamp NULL DEFAULT NULL,
  `updated_at` timestamp NULL DEFAULT NULL
) ENGINE=InnoDB DEFAULT CHARSET=utf8mb4 COLLATE=utf8mb4_unicode_ci;

--
-- Dumping data for table `client_orders`
--

INSERT INTO `client_orders` (`id`, `title`, `priority`, `description`, `date`, `user_id`, `client_id`, `order_user_id`, `type`, `time`, `status`, `created_at`, `updated_at`) VALUES
(32, 'dhth', '', 'yheh', '2023-11-20', 1, 23, 49, 'colleague', '10:21', 'close', '2023-11-23 04:51:53', '2023-11-23 04:52:40'),
(35, 'ryji', 'medium', 'rsj', '2023-11-25', 1, 23, 0, 'self', '10:23', 'completed', '2023-11-23 04:53:26', '2024-04-09 07:42:28'),
(37, 'AF', '', 'AG', '2023-11-21', 1, 23, 29, 'colleague', '10:35', 'close', '2023-11-23 05:06:14', '2023-12-12 01:19:02'),
(38, 'dhjyrj', '', 'ryj5ik', '2023-11-24', 1, 23, 29, 'colleague', '06:55', 'open', '2023-11-24 01:26:05', '2023-11-24 01:26:05'),
(39, 'rsujru', 'low', 'sruj6u57', '2023-11-24', 1, 23, 0, 'self', '06:56', 'completed', '2023-11-24 01:26:14', '2024-05-09 06:18:19'),
(40, 'test1', 'medium', 'tester12', '2023-11-24', 1, 23, 1, 'self', '09:07', 'completed', '2023-11-24 03:37:33', '2024-05-27 00:23:35'),
(41, 'ok', 'medium', 'rhsh', '2023-11-24', 1, 23, 1, 'self', '09:11', 'completed', '2023-11-24 03:41:59', '2024-04-05 07:08:17'),
(42, 'srh', 'low', 'sh', '2023-11-24', 53, 23, 53, 'appointment', '09:20', 'open', '2023-11-24 03:50:26', '2023-11-24 03:50:26'),
(43, 'erhw', '', 'erhw', '2023-11-24', 53, 23, 29, 'colleague', '09:20', 'open', '2023-11-24 03:50:32', '2023-11-24 03:50:32'),
(44, 'ehwj', 'low', 'etha', '2023-11-24', 53, 23, 53, 'self', '09:20', 'open', '2023-11-24 03:50:40', '2023-11-24 03:50:40'),
(45, 'h', 'low', 'etha', '2023-11-24', 29, 23, 29, 'appointment', '10:02', 'open', '2023-11-24 04:32:05', '2023-11-24 04:32:05'),
(46, 'he', '', 'he', '2023-11-24', 29, 23, 29, 'colleague', '10:02', 'close', '2023-11-24 04:32:10', '2023-11-24 04:32:41'),
(47, 'he', 'medium', 'h35q', '2023-11-24', 29, 23, 29, 'self', '10:02', 'close', '2023-11-24 04:32:17', '2023-11-24 04:32:27'),
(48, 'all', 'low', 'alll users', '2023-12-01', 1, 23, 1, 'appointment', '03:33', 'open', '2023-11-30 22:03:51', '2023-11-30 22:03:51'),
(49, 'doctor seceratery lab tech', '', '54u6', '2023-12-01', 1, 23, 29, 'colleague', '03:33', 'open', '2023-11-30 22:04:14', '2023-11-30 22:04:14'),
(50, 'admin', 'medium', 'admin obly', '2023-12-01', 1, 23, 1, 'self', '03:34', 'completed', '2023-11-30 22:04:31', '2024-02-23 04:29:27'),
(51, 'etj', 'medium', 'ejy', '2023-12-01', 29, 23, 29, 'appointment', '04:11', 'open', '2023-11-30 22:41:11', '2023-11-30 22:41:11'),
(52, 'eu', 'medium', 'e5u', '2023-12-01', 1, 23, 1, 'appointment', '09:15', 'open', '2023-12-01 03:45:35', '2023-12-01 03:45:35'),
(53, '67ki', 'medium', '57i', '2023-12-01', 1, 23, 1, 'appointment', '09:16', 'open', '2023-12-01 03:46:24', '2023-12-01 03:46:24'),
(54, 'sefsefsef', 'medium', 'wadwd', '2023-12-01', 1, 23, 1, 'appointment', '10:25', 'open', '2023-12-01 04:55:21', '2023-12-01 04:55:21'),
(55, 'rge', 'medium', '3h3q5', '2023-12-04', 1, 23, 1, 'appointment', '06:32', 'open', '2023-12-04 01:02:14', '2023-12-04 01:02:14'),
(56, 'rehg35', '', 'e5hy53', '2023-12-04', 1, 23, 53, 'colleague', '06:32', 'open', '2023-12-04 01:02:24', '2023-12-04 01:02:24'),
(57, '35h', 'medium', '5yh35', '2023-12-04', 1, 23, 1, 'self', '06:32', 'completed', '2023-12-04 01:02:30', '2024-02-23 04:29:16'),
(58, '4ty53y', '', 'y35uy3', '2023-12-04', 1, 23, 29, 'colleague', '08:53', 'open', '2023-12-04 03:23:28', '2023-12-04 03:23:28'),
(59, 'aaaaaaaaaaaaa', '', 'aaaaaaaaaaaaaaaaaaaa', '2023-12-04', 1, 23, 29, 'colleague', '08:55', 'open', '2023-12-04 03:25:25', '2023-12-04 03:25:25'),
(60, 'admin myself', 'low', 'admin', '2023-12-05', 1, 23, 1, 'self', '12:38', 'completed', '2023-12-05 07:08:32', '2024-02-23 04:29:03'),
(61, 'lab', '', 'lab', '2023-12-05', 1, 23, 49, 'colleague', '12:39', 'open', '2023-12-05 07:09:43', '2023-12-05 07:09:43'),
(62, 'user', 'medium', 'user', '2023-12-05', 1, 23, 1, 'appointment', '12:39', 'open', '2023-12-05 07:09:53', '2023-12-05 07:09:53'),
(63, 'doct1', 'high', 'wrh', '2023-12-05', 29, 23, 29, 'self', '12:43', 'open', '2023-12-05 07:13:51', '2023-12-05 07:13:51'),
(64, 'colleage1 lab1', '', 'wryh', '2023-12-05', 29, 23, 49, 'colleague', '12:43', 'close', '2023-12-05 07:14:10', '2023-12-06 07:02:48'),
(65, 'user1', 'low', 'user', '2023-12-05', 29, 23, 29, 'appointment', '12:44', 'open', '2023-12-05 07:14:21', '2023-12-05 07:14:21'),
(66, 'doc myself', 'low', 'myself doc', '2023-12-05', 29, 23, 29, 'self', '12:47', 'open', '2023-12-05 07:17:44', '2023-12-05 07:17:44'),
(68, 'sec test', 'medium', 'sec test', '2023-12-05', 53, 23, 53, 'self', '12:49', 'open', '2023-12-05 07:19:58', '2023-12-05 07:19:58'),
(69, 'doc1', '', 'doc1', '2023-12-05', 53, 23, 29, 'colleague', '12:49', 'open', '2023-12-05 07:20:09', '2023-12-05 07:20:09'),
(70, 'user1', 'high', 'shw', '2023-12-05', 53, 23, 53, 'appointment', '12:50', 'open', '2023-12-05 07:20:18', '2023-12-05 07:20:18'),
(71, 'apt1', 'medium', 'appointment', '2023-12-05', 53, 23, 53, 'appointment', '12:52', 'open', '2023-12-05 07:22:55', '2023-12-05 07:22:55'),
(72, 'my sec', 'low', 'my sec', '2023-12-05', 53, 23, 53, 'self', '12:52', 'open', '2023-12-05 07:23:06', '2023-12-05 07:23:06'),
(74, 'not show', 'medium', 'order_user_id', '2023-12-06', 1, 23, 1, 'appointment', '04:05', 'open', '2023-12-05 22:35:25', '2023-12-05 22:35:25'),
(75, 'not show self', 'low', 'not show self', '2023-12-06', 1, 23, 1, 'self', '04:05', 'completed', '2023-12-05 22:35:51', '2024-02-23 03:59:49'),
(76, 'show doc', '', 'not show', '2023-12-06', 1, 23, 29, 'colleague', '04:05', 'open', '2023-12-05 22:36:08', '2023-12-05 22:36:08'),
(77, 'show lab1', '', 'not show', '2023-12-06', 1, 23, 49, 'colleague', '04:06', 'open', '2023-12-05 22:36:23', '2023-12-05 22:36:23'),
(78, 'show sec', '', 'not show', '2023-12-06', 1, 23, 53, 'colleague', '04:06', 'open', '2023-12-05 22:36:39', '2023-12-05 22:36:39'),
(83, 'appt seceratries', 'medium', 'appt seceratries testcs', '2023-12-06', 29, 23, 1, 'appointment', '06:34', 'open', '2023-12-06 01:05:40', '2024-09-04 01:29:12'),
(85, 'la', '', 'ab', '2023-12-06', 29, 23, 49, 'colleague', '11:22', 'completed', '2023-12-06 05:52:55', '2024-06-17 01:53:03'),
